Rank,UniProt_ID,STRING_ID,Protein_Names,pLLPS_Score
1,P85037,FOXK1_HUMAN,Forkhead box protein K1 (Myocyte nuclear factor) (MNF),1.0
2,Q7RTP6,MICA3_HUMAN,[F-actin]-monooxygenase MICAL3 (EC 1.14.13.225) (Molecule interacting with CasL protein 3) (MICAL-3),1.0
3,Q01167,FOXK2_HUMAN,Forkhead box protein K2 (G/T-mismatch specific binding protein) (nGTBP) (Interleukin enhancer-binding factor 1),1.0
4,Q86VQ3,TXND2_HUMAN,Thioredoxin domain-containing protein 2 (Spermatid-specific thioredoxin-1) (Sptrx-1),1.0
5,O60936,NOL3_HUMAN,Nucleolar protein 3 (Apoptosis repressor with CARD) (Muscle-enriched cytoplasmic protein) (Myp) (Nucleolar protein of 30 kDa) (Nop30),0.99
6,Q08397,LOXL1_HUMAN,Lysyl oxidase homolog 1 (EC 1.4.3.-) (Lysyl oxidase-like protein 1) (LOL),0.99
7,Q96EB6,SIR1_HUMAN,NAD-dependent protein deacetylase sirtuin-1 (hSIRT1) (EC 2.3.1.286) (NAD-dependent protein deacylase sirtuin-1) (EC 2.3.1.-) (Regulatory protein SIR2 homolog 1) (SIR2-like protein 1) (hSIR2) [Cleaved into: SirtT1 75 kDa fragment (75SirT1)],0.99
8,Q5VUM1,SDHF4_HUMAN,"Succinate dehydrogenase assembly factor 4, mitochondrial (SDH assembly factor 4) (SDHAF4)",0.99
9,P80192,M3K9_HUMAN,Mitogen-activated protein kinase kinase kinase 9 (EC 2.7.11.25) (Mixed lineage kinase 1),0.98
10,P29353,SHC1_HUMAN,SHC-transforming protein 1 (SHC-transforming protein 3) (SHC-transforming protein A) (Src homology 2 domain-containing-transforming protein C1) (SH2 domain protein C1),0.98
11,Q86VP3,PACS2_HUMAN,Phosphofurin acidic cluster sorting protein 2 (PACS-2) (PACS1-like protein),0.97
12,Q96A73,P33MX_HUMAN,Putative monooxygenase p33MONOX (EC 1.-.-.-) (Brain-derived rescue factor p60MONOX) (Flavin monooxygenase motif-containing protein of 33 kDa),0.97
13,P56181,NDUV3_HUMAN,"NADH dehydrogenase [ubiquinone] flavoprotein 3, mitochondrial (Complex I-9kD) (CI-9kD) (NADH-ubiquinone oxidoreductase 9 kDa subunit) (Renal carcinoma antigen NY-REN-4)",0.96
14,Q92538,GBF1_HUMAN,Golgi-specific brefeldin A-resistance guanine nucleotide exchange factor 1 (BFA-resistant GEF 1),0.96
15,Q92622,RUBIC_HUMAN,Run domain Beclin-1-interacting and cysteine-rich domain-containing protein (Rubicon) (Beclin-1 associated RUN domain containing protein) (Baron),0.95
16,Q9BVT8,TMUB1_HUMAN,Transmembrane and ubiquitin-like domain-containing protein 1 (Dendritic cell-derived ubiquitin-like protein) (DULP) (Hepatocyte odd protein shuttling protein) (Ubiquitin-like protein SB144) [Cleaved into: iHOPS],0.93
17,Q49B96,COX19_HUMAN,Cytochrome c oxidase assembly protein COX19 (hCOX19),0.9
18,Q9Y6M9,NDUB9_HUMAN,NADH dehydrogenase [ubiquinone] 1 beta subcomplex subunit 9 (Complex I-B22) (CI-B22) (LYR motif-containing protein 3) (NADH-ubiquinone oxidoreductase B22 subunit),0.9
19,P55789,ALR_HUMAN,FAD-linked sulfhydryl oxidase ALR (EC 1.8.3.2) (Augmenter of liver regeneration) (hERV1) (Hepatopoietin),0.88
20,P10606,COX5B_HUMAN,"Cytochrome c oxidase subunit 5B, mitochondrial (Cytochrome c oxidase polypeptide Vb)",0.88
21,Q86UR1,NOXA1_HUMAN,NADPH oxidase activator 1 (NOX activator 1) (Antigen NY-CO-31) (NCF2-like protein) (P67phox-like factor) (p51-nox),0.87
22,Q9Y3D2,MSRB2_HUMAN,"Methionine-R-sulfoxide reductase B2, mitochondrial (MsrB2) (EC 1.8.4.12) (EC 1.8.4.14)",0.86
23,P19878,NCF2_HUMAN,Neutrophil cytosol factor 2 (NCF-2) (67 kDa neutrophil oxidase factor) (NADPH oxidase activator 2) (Neutrophil NADPH oxidase factor 2) (p67-phox),0.84
24,Q8NFA2,NOXO1_HUMAN,NADPH oxidase organizer 1 (NADPH oxidase regulatory protein) (Nox organizer 1) (Nox-organizing protein 1) (SH3 and PX domain-containing protein 5),0.84
25,Q02221,CX6A2_HUMAN,"Cytochrome c oxidase subunit 6A2, mitochondrial (Cytochrome c oxidase polypeptide VIa-heart) (COXVIAH) (Cytochrome c oxidase subunit VIA-muscle) (COX VIa-M)",0.84
26,Q9NRA0,SPHK2_HUMAN,Sphingosine kinase 2 (SK 2) (SPK 2) (EC 2.7.1.91),0.84
27,A8MVU1,NCF1C_HUMAN,Putative neutrophil cytosol factor 1C (NCF-1C) (Putative SH3 and PX domain-containing protein 1C),0.83
28,Q8NBK3,SUMF1_HUMAN,Formylglycine-generating enzyme (FGE) (EC 1.8.3.7) (C-alpha-formylglycine-generating enzyme 1) (Sulfatase-modifying factor 1),0.82
29,A6NFY7,SDHF1_HUMAN,"Succinate dehydrogenase assembly factor 1, mitochondrial (SDH assembly factor 1) (SDHAF1) (LYR motif-containing protein 8)",0.82
30,P10515,ODP2_HUMAN,"Dihydrolipoyllysine-residue acetyltransferase component of pyruvate dehydrogenase complex, mitochondrial (EC 2.3.1.12) (70 kDa mitochondrial autoantigen of primary biliary cirrhosis) (PBC) (Dihydrolipoamide acetyltransferase component of pyruvate dehydrogenase complex) (M2 antigen complex 70 kDa subunit) (Pyruvate dehydrogenase complex component E2) (PDC-E2) (PDCE2)",0.82
31,Q96EY1,DNJA3_HUMAN,"DnaJ homolog subfamily A member 3, mitochondrial (DnaJ protein Tid-1) (hTid-1) (Hepatocellular carcinoma-associated antigen 57) (Tumorous imaginal discs protein Tid56 homolog)",0.82
32,Q8TDZ2,MICA1_HUMAN,[F-actin]-monooxygenase MICAL1 (EC 1.14.13.225) (Molecule interacting with CasL protein 1) (MICAL-1) (NEDD9-interacting protein with calponin homology and LIM domains),0.8
33,P07919,QCR6_HUMAN,"Cytochrome b-c1 complex subunit 6, mitochondrial (Complex III subunit 6) (Complex III subunit VIII) (Cytochrome c1 non-heme 11 kDa protein) (Mitochondrial hinge protein) (Ubiquinol-cytochrome c reductase complex 11 kDa protein)",0.8
34,Q9NS69,TOM22_HUMAN,Mitochondrial import receptor subunit TOM22 homolog (hTom22) (1C9-2) (Translocase of outer membrane 22 kDa subunit homolog),0.78
35,P11474,ERR1_HUMAN,Steroid hormone receptor ERR1 (Estrogen receptor-like 1) (Estrogen-related receptor alpha) (ERR-alpha) (Nuclear receptor subfamily 3 group B member 1),0.78
36,P12074,CX6A1_HUMAN,"Cytochrome c oxidase subunit 6A1, mitochondrial (Cytochrome c oxidase polypeptide VIa-liver) (Cytochrome c oxidase subunit VIA-liver) (COX VIa-L)",0.78
37,Q14061,COX17_HUMAN,Cytochrome c oxidase copper chaperone,0.77
38,Q96GN5,CDA7L_HUMAN,Cell division cycle-associated 7-like protein (Protein JPO2) (Transcription factor RAM2),0.77
39,Q9H0H9,C4F30_HUMAN,Putative cytochrome P450 family member 4F30,0.77
40,A0A096LP55,QCR6L_HUMAN,"Cytochrome b-c1 complex subunit 6-like, mitochondrial",0.76
41,O95169,NDUB8_HUMAN,"NADH dehydrogenase [ubiquinone] 1 beta subcomplex subunit 8, mitochondrial (Complex I-ASHI) (CI-ASHI) (NADH-ubiquinone oxidoreductase ASHI subunit)",0.75
42,Q9NX14,NDUBB_HUMAN,"NADH dehydrogenase [ubiquinone] 1 beta subcomplex subunit 11, mitochondrial (Complex I-ESSS) (CI-ESSS) (NADH-ubiquinone oxidoreductase ESSS subunit) (Neuronal protein 17.3) (Np17.3) (p17.3)",0.74
43,O43169,CYB5B_HUMAN,Cytochrome b5 type B (Cytochrome b5 outer mitochondrial membrane isoform),0.72
44,O75509,TNR21_HUMAN,Tumor necrosis factor receptor superfamily member 21 (Death receptor 6) (CD antigen CD358),0.72
45,Q92830,KAT2A_HUMAN,Histone acetyltransferase KAT2A (EC 2.3.1.48) (General control of amino acid synthesis protein 5-like 2) (Histone acetyltransferase GCN5) (hGCN5) (Histone glutaryltransferase KAT2A) (EC 2.3.1.-) (Histone succinyltransferase KAT2A) (EC 2.3.1.-) (Lysine acetyltransferase 2A) (STAF97),0.71
46,A6NI72,NCF1B_HUMAN,Putative neutrophil cytosol factor 1B (NCF-1B) (Putative SH3 and PX domain-containing protein 1B),0.71
47,P28300,LYOX_HUMAN,"Protein-lysine 6-oxidase (EC 1.4.3.13) (Lysyl oxidase) [Cleaved into: Protein-lysine 6-oxidase, long form; Protein-lysine 6-oxidase, short form]",0.7
48,Q9NYJ1,COA4_HUMAN,"Cytochrome c oxidase assembly factor 4 homolog, mitochondrial (Coiled-coil-helix-coiled-coil-helix domain-containing protein 8) (E2-induced gene 2 protein)",0.7
49,P53701,CCHL_HUMAN,Cytochrome c-type heme lyase (CCHL) (EC 4.4.1.17) (Holocytochrome c-type synthase),0.69
50,Q14114,LRP8_HUMAN,Low-density lipoprotein receptor-related protein 8 (LRP-8) (Apolipoprotein E receptor 2),0.68
51,P51687,SUOX_HUMAN,"Sulfite oxidase, mitochondrial (EC 1.8.3.1)",0.68
52,O75880,SCO1_HUMAN,"Protein SCO1 homolog, mitochondrial",0.67
53,Q8IXL7,MSRB3_HUMAN,Methionine-R-sulfoxide reductase B3 (MsrB3) (EC 1.8.4.12) (EC 1.8.4.14),0.66
54,Q96LC7,SIG10_HUMAN,Sialic acid-binding Ig-like lectin 10 (Siglec-10) (Siglec-like protein 2),0.66
55,P17643,TYRP1_HUMAN,"5,6-dihydroxyindole-2-carboxylic acid oxidase (DHICA oxidase) (EC 1.14.18.-) (Catalase B) (Glycoprotein 75) (Melanoma antigen gp75) (Tyrosinase-related protein 1) (TRP) (TRP-1) (TRP1)",0.66
56,Q8WXS8,ATS14_HUMAN,A disintegrin and metalloproteinase with thrombospondin motifs 14 (ADAM-TS 14) (ADAM-TS14) (ADAMTS-14) (EC 3.4.24.-),0.65
57,Q16206,ENOX2_HUMAN,Ecto-NOX disulfide-thiol exchanger 2 (APK1 antigen) (Cytosolic ovarian carcinoma antigen 1) (Tumor-associated hydroquinone oxidase) (tNOX) [Includes: Hydroquinone [NADH] oxidase (EC 1.-.-.-); Protein disulfide-thiol oxidoreductase (EC 1.-.-.-)],0.65
58,P13498,CY24A_HUMAN,Cytochrome b-245 light chain (Cytochrome b(558) alpha chain) (Cytochrome b558 subunit alpha) (Neutrophil cytochrome b 22 kDa polypeptide) (Superoxide-generating NADPH oxidase light chain subunit) (p22 phagocyte B-cytochrome) (p22-phox) (p22phox),0.64
59,O94851,MICA2_HUMAN,[F-actin]-monooxygenase MICAL2 (EC 1.14.13.225) (Molecule interacting with CasL protein 2) (MICAL-2),0.63
60,O95298,NDUC2_HUMAN,NADH dehydrogenase [ubiquinone] 1 subunit C2 (Complex I-B14.5b) (CI-B14.5b) (Human lung cancer oncogene 1 protein) (HLC-1) (NADH-ubiquinone oxidoreductase subunit B14.5b),0.63
61,P14598,NCF1_HUMAN,Neutrophil cytosol factor 1 (NCF-1) (47 kDa autosomal chronic granulomatous disease protein) (47 kDa neutrophil oxidase factor) (NCF-47K) (Neutrophil NADPH oxidase factor 1) (Nox organizer 2) (Nox-organizing protein 2) (SH3 and PX domain-containing protein 1A) (p47-phox),0.62
62,O95831,AIFM1_HUMAN,"Apoptosis-inducing factor 1, mitochondrial (EC 1.6.99.-) (Programmed cell death protein 8)",0.62
63,Q9Y6N1,COX11_HUMAN,"Cytochrome c oxidase assembly protein COX11, mitochondrial",0.61
64,P49748,ACADV_HUMAN,"Very long-chain specific acyl-CoA dehydrogenase, mitochondrial (VLCAD) (EC 1.3.8.9)",0.6
65,Q6ZRP7,QSOX2_HUMAN,Sulfhydryl oxidase 2 (EC 1.8.3.2) (Neuroblastoma-derived sulfhydryl oxidase) (Quiescin Q6-like protein 1),0.6
66,Q96KJ9,COX42_HUMAN,"Cytochrome c oxidase subunit 4 isoform 2, mitochondrial (Cytochrome c oxidase subunit IV isoform 2) (COX IV-2)",0.6
67,P10109,ADX_HUMAN,"Adrenodoxin, mitochondrial (Adrenal ferredoxin) (Ferredoxin-1) (Hepatoredoxin)",0.58
68,Q16853,AOC3_HUMAN,Membrane primary amine oxidase (EC 1.4.3.21) (Copper amine oxidase) (HPAO) (Semicarbazide-sensitive amine oxidase) (SSAO) (Vascular adhesion protein 1) (VAP-1),0.58
69,Q9H7D7,WDR26_HUMAN,WD repeat-containing protein 26 (CUL4- and DDB1-associated WDR protein 2) (Myocardial ischemic preconditioning up-regulated protein 2),0.58
70,O14733,MP2K7_HUMAN,Dual specificity mitogen-activated protein kinase kinase 7 (MAP kinase kinase 7) (MAPKK 7) (EC 2.7.12.2) (JNK-activating kinase 2) (MAPK/ERK kinase 7) (MEK 7) (Stress-activated protein kinase kinase 4) (SAPK kinase 4) (SAPKK-4) (SAPKK4) (c-Jun N-terminal kinase kinase 2) (JNK kinase 2) (JNKK 2),0.57
71,Q6UW78,UQCC3_HUMAN,Ubiquinol-cytochrome-c reductase complex assembly factor 3 (Assembly factor CBP4 homolog),0.57
72,P49327,FAS_HUMAN,Fatty acid synthase (EC 2.3.1.85) [Includes: [Acyl-carrier-protein] S-acetyltransferase (EC 2.3.1.38); [Acyl-carrier-protein] S-malonyltransferase (EC 2.3.1.39); 3-oxoacyl-[acyl-carrier-protein] synthase (EC 2.3.1.41); 3-oxoacyl-[acyl-carrier-protein] reductase (EC 1.1.1.100); 3-hydroxyacyl-[acyl-carrier-protein] dehydratase (EC 4.2.1.59); Enoyl-[acyl-carrier-protein] reductase (EC 1.3.1.39); Oleoyl-[acyl-carrier-protein] hydrolase (EC 3.1.2.14)],0.57
73,Q7Z4L0,COX8C_HUMAN,"Cytochrome c oxidase subunit 8C, mitochondrial (Cytochrome c oxidase polypeptide 8 isoform 3) (Cytochrome c oxidase polypeptide VIII isoform 3) (COX VIII-3) (Cytochrome c oxidase subunit 8-3) (COX8-3) (Cytochrome c oxidase subunit VIIIC)",0.57
74,Q9GZY4,COA1_HUMAN,Cytochrome c oxidase assembly factor 1 homolog (Mitochondrial translation regulation assembly intermediate of cytochrome c oxidase protein of 15 kDa),0.57
75,O00330,ODPX_HUMAN,"Pyruvate dehydrogenase protein X component, mitochondrial (Dihydrolipoamide dehydrogenase-binding protein of pyruvate dehydrogenase complex) (E3-binding protein) (E3BP) (Lipoyl-containing pyruvate dehydrogenase complex component X) (proX)",0.56
76,Q6GPH4,XAF1_HUMAN,XIAP-associated factor 1 (BIRC4-binding protein),0.56
77,P58004,SESN2_HUMAN,Sestrin-2 (EC 1.11.1.-) (Hypoxia-induced gene),0.56
78,Q9UJ68,MSRA_HUMAN,Mitochondrial peptide methionine sulfoxide reductase (EC 1.8.4.11) (Peptide-methionine (S)-S-oxide reductase) (Peptide Met(O) reductase) (Protein-methionine-S-oxide reductase) (PMSR),0.54
79,Q9ULD0,OGDHL_HUMAN,"2-oxoglutarate dehydrogenase-like, mitochondrial (EC 1.2.4.-) (2-oxoglutarate dehydrogenase complex component E1-like) (OGDC-E1-like) (Alpha-ketoglutarate dehydrogenase-like)",0.54
80,P55957,BID_HUMAN,BH3-interacting domain death agonist (p22 BID) (BID) [Cleaved into: BH3-interacting domain death agonist p15 (p15 BID); BH3-interacting domain death agonist p13 (p13 BID); BH3-interacting domain death agonist p11 (p11 BID)],0.54
81,Q5BKU9,OXLD1_HUMAN,Oxidoreductase-like domain-containing protein 1,0.53
82,Q8N183,NDUF2_HUMAN,NADH dehydrogenase [ubiquinone] 1 alpha subcomplex assembly factor 2 (B17.2-like) (B17.2L) (Mimitin) (Myc-induced mitochondrial protein) (MMTN) (NDUFA12-like protein),0.53
83,P10415,BCL2_HUMAN,Apoptosis regulator Bcl-2,0.52
84,Q8TC92,ENOX1_HUMAN,Ecto-NOX disulfide-thiol exchanger 1 (Candidate growth-related and time keeping constitutive hydroquinone [NADH] oxidase) (cCNOX) (Cell proliferation-inducing gene 38 protein) (Constitutive Ecto-NOX) (cNOX) [Includes: Hydroquinone [NADH] oxidase (EC 1.-.-.-); Protein disulfide-thiol oxidoreductase (EC 1.-.-.-)],0.52
85,O43819,SCO2_HUMAN,"Protein SCO2 homolog, mitochondrial",0.52
86,P36551,HEM6_HUMAN,"Oxygen-dependent coproporphyrinogen-III oxidase, mitochondrial (COX) (Coprogen oxidase) (Coproporphyrinogenase) (EC 1.3.3.3)",0.5
87,Q15526,SURF1_HUMAN,Surfeit locus protein 1,0.5
88,Q96GE9,DMAC1_HUMAN,Distal membrane-arm assembly complex protein 1 (Transmembrane protein 261),0.5
89,Q9NRD8,DUOX2_HUMAN,Dual oxidase 2 (EC 1.11.1.-) (EC 1.6.3.1) (Large NOX 2) (Long NOX 2) (NADH/NADPH thyroid oxidase p138-tox) (NADPH oxidase/peroxidase DUOX2) (NADPH thyroid oxidase 2) (Thyroid oxidase 2) (p138 thyroid oxidase),0.49
90,O95450,ATS2_HUMAN,A disintegrin and metalloproteinase with thrombospondin motifs 2 (ADAM-TS 2) (ADAM-TS2) (ADAMTS-2) (EC 3.4.24.14) (Procollagen I N-proteinase) (PC I-NP) (Procollagen I/II amino propeptide-processing enzyme) (Procollagen N-endopeptidase) (pNPI),0.49
91,P30405,PPIF_HUMAN,"Peptidyl-prolyl cis-trans isomerase F, mitochondrial (PPIase F) (EC 5.2.1.8) (Cyclophilin D) (CyP-D) (CypD) (Cyclophilin F) (Mitochondrial cyclophilin) (CyP-M) (Rotamase F)",0.49
92,Q9BQ95,ECSIT_HUMAN,"Evolutionarily conserved signaling intermediate in Toll pathway, mitochondrial (Protein SITPEC)",0.47
93,Q9Y375,CIA30_HUMAN,"Complex I intermediate-associated protein 30, mitochondrial (NADH dehydrogenase [ubiquinone] 1 alpha subcomplex assembly factor 1)",0.47
94,P78363,ABCA4_HUMAN,Retinal-specific phospholipid-transporting ATPase ABCA4 (EC 7.6.2.1) (ATP-binding cassette sub-family A member 4) (RIM ABC transporter) (RIM protein) (RmP) (Retinal-specific ATP-binding cassette transporter) (Stargardt disease protein),0.47
95,Q9NWM0,SMOX_HUMAN,Spermine oxidase (EC 1.5.3.16) (Polyamine oxidase 1) (PAO-1) (PAOh1),0.47
96,O95182,NDUA7_HUMAN,NADH dehydrogenase [ubiquinone] 1 alpha subcomplex subunit 7 (Complex I-B14.5a) (CI-B14.5a) (NADH-ubiquinone oxidoreductase subunit B14.5a),0.47
97,Q96SQ9,CP2S1_HUMAN,Cytochrome P450 2S1 (EC 1.14.14.-) (CYPIIS1) (Hydroperoxy icosatetraenoate dehydratase) (EC 4.2.1.152) (Thromboxane-A synthase) (EC 5.3.99.5),0.47
98,O14874,BCKD_HUMAN,"[3-methyl-2-oxobutanoate dehydrogenase [lipoamide]] kinase, mitochondrial (EC 2.7.11.4) (Branched-chain alpha-ketoacid dehydrogenase kinase) (BCKD-kinase) (BCKDHKIN)",0.46
99,O95139,NDUB6_HUMAN,NADH dehydrogenase [ubiquinone] 1 beta subcomplex subunit 6 (Complex I-B17) (CI-B17) (NADH-ubiquinone oxidoreductase B17 subunit),0.46
100,Q96EN8,MOCOS_HUMAN,Molybdenum cofactor sulfurase (MCS) (MOS) (MoCo sulfurase) (hMCS) (EC 2.8.1.9) (Molybdenum cofactor sulfurtransferase),0.46
101,Q9NRP2,COXM2_HUMAN,COX assembly mitochondrial protein 2 homolog,0.45
102,P42898,MTHR_HUMAN,Methylenetetrahydrofolate reductase (EC 1.5.1.20),0.45
103,O43181,NDUS4_HUMAN,"NADH dehydrogenase [ubiquinone] iron-sulfur protein 4, mitochondrial (Complex I-18 kDa) (CI-18 kDa) (Complex I-AQDQ) (CI-AQDQ) (NADH-ubiquinone oxidoreductase 18 kDa subunit)",0.45
104,Q05823,RN5A_HUMAN,2-5A-dependent ribonuclease (2-5A-dependent RNase) (EC 3.1.26.-) (Ribonuclease 4) (Ribonuclease L) (RNase L),0.45
105,Q6FI81,CPIN1_HUMAN,Anamorsin (Cytokine-induced apoptosis inhibitor 1) (Fe-S cluster assembly protein DRE2 homolog),0.44
106,Q9Y6L7,TLL2_HUMAN,Tolloid-like protein 2 (EC 3.4.24.-),0.44
107,Q9BSH4,TACO1_HUMAN,Translational activator of cytochrome c oxidase 1 (Coiled-coil domain-containing protein 44) (Translational activator of mitochondrially-encoded cytochrome c oxidase I),0.43
108,O95167,NDUA3_HUMAN,NADH dehydrogenase [ubiquinone] 1 alpha subcomplex subunit 3 (Complex I-B9) (CI-B9) (NADH-ubiquinone oxidoreductase B9 subunit),0.43
109,Q9H1K1,ISCU_HUMAN,"Iron-sulfur cluster assembly enzyme ISCU, mitochondrial (NifU-like N-terminal domain-containing protein) (NifU-like protein)",0.43
110,Q9UHQ9,NB5R1_HUMAN,NADH-cytochrome b5 reductase 1 (b5R.1) (EC 1.6.2.2) (Humb5R2) (NAD(P)H:quinone oxidoreductase type 3 polypeptide A2),0.43
111,P00390,GSHR_HUMAN,"Glutathione reductase, mitochondrial (GR) (GRase) (EC 1.8.1.7)",0.42
112,O95881,TXD12_HUMAN,Thioredoxin domain-containing protein 12 (EC 1.8.4.2) (Endoplasmic reticulum resident protein 18) (ER protein 18) (ERp18) (Endoplasmic reticulum resident protein 19) (ER protein 19) (ERp19) (Thioredoxin-like protein p19) (hTLP19),0.41
113,P23378,GCSP_HUMAN,"Glycine dehydrogenase (decarboxylating), mitochondrial (EC 1.4.4.2) (Glycine cleavage system P protein) (Glycine decarboxylase) (Glycine dehydrogenase (aminomethyl-transferring))",0.41
114,Q96PH1,NOX5_HUMAN,NADPH oxidase 5 (EC 1.6.3.-),0.4
115,P08574,CY1_HUMAN,"Cytochrome c1, heme protein, mitochondrial (EC 7.1.1.8) (Complex III subunit 4) (Complex III subunit IV) (Cytochrome b-c1 complex subunit 4) (Ubiquinol-cytochrome-c reductase complex cytochrome c1 subunit) (Cytochrome c-1)",0.4
116,Q8WU39,MZB1_HUMAN,Marginal zone B- and B1-cell-specific protein (Mesenteric estrogen-dependent adipose 7) (MEDA-7) (Plasma cell-induced resident endoplasmic reticulum protein) (Plasma cell-induced resident ER protein) (pERp1) (Proapoptotic caspase adapter protein),0.4
117,O00429,DNM1L_HUMAN,Dynamin-1-like protein (EC 3.6.5.5) (Dnm1p/Vps1p-like protein) (DVLP) (Dynamin family member proline-rich carboxyl-terminal domain less) (Dymple) (Dynamin-like protein) (Dynamin-like protein 4) (Dynamin-like protein IV) (HdynIV) (Dynamin-related protein 1),0.39
118,O43272,PROD_HUMAN,"Proline dehydrogenase 1, mitochondrial (EC 1.5.5.2) (Proline oxidase) (Proline oxidase 2) (p53-induced gene 6 protein)",0.39
119,Q6V0L0,CP26C_HUMAN,Cytochrome P450 26C1 (EC 1.14.-.-),0.39
120,Q9UBK8,MTRR_HUMAN,Methionine synthase reductase (MSR) (EC 1.16.1.8) (Aquacobalamin reductase) (AqCbl reductase) (EC 1.16.1.5),0.39
121,P49448,DHE4_HUMAN,"Glutamate dehydrogenase 2, mitochondrial (GDH 2) (EC 1.4.1.3)",0.39
122,P51589,CP2J2_HUMAN,Cytochrome P450 2J2 (EC 1.14.14.-) (Albendazole monooxygenase (hydroxylating)) (EC 1.14.14.74) (Albendazole monooxygenase (sulfoxide-forming)) (EC 1.14.14.73) (Arachidonic acid epoxygenase) (CYPIIJ2) (Hydroperoxy icosatetraenoate isomerase) (EC 5.4.4.7),0.39
123,Q9UL12,SARDH_HUMAN,"Sarcosine dehydrogenase, mitochondrial (SarDH) (EC 1.5.8.3) (BPR-2)",0.39
124,Q9P0S2,COX16_HUMAN,"Cytochrome c oxidase assembly protein COX16 homolog, mitochondrial (hCOX16)",0.38
125,O43897,TLL1_HUMAN,Tolloid-like protein 1 (EC 3.4.24.-),0.37
126,Q9Y4U1,MMAC_HUMAN,Cyanocobalamin reductase / alkylcobalamin dealkylase (Alkylcobalamin:glutathione S-alkyltransferase) (EC 2.5.1.151) (CblC) (Cyanocobalamin reductase (cyanide-eliminating)) (EC 1.16.1.6) (Methylmalonic aciduria and homocystinuria type C protein) (MMACHC),0.37
127,Q16678,CP1B1_HUMAN,Cytochrome P450 1B1 (EC 1.14.14.1) (CYPIB1) (Hydroperoxy icosatetraenoate dehydratase) (EC 4.2.1.152),0.37
128,Q86SK9,SCD5_HUMAN,Stearoyl-CoA desaturase 5 (EC 1.14.19.1) (Acyl-CoA-desaturase 4) (HSCD5) (Stearoyl-CoA 9-desaturase) (Stearoyl-CoA desaturase 2),0.37
129,Q49A26,GLYR1_HUMAN,Putative oxidoreductase GLYR1 (EC 1.-.-.-) (3-hydroxyisobutyrate dehydrogenase-like protein) (Cytokine-like nuclear factor N-PAC) (Glyoxylate reductase 1 homolog) (Nuclear protein NP60) (Nuclear protein of 60 kDa) (Nucleosome-destabilizing factor) (hNDF),0.37
130,P09417,DHPR_HUMAN,Dihydropteridine reductase (EC 1.5.1.34) (HDHPR) (Quinoid dihydropteridine reductase) (Short chain dehydrogenase/reductase family 33C member 1),0.36
131,P45985,MP2K4_HUMAN,Dual specificity mitogen-activated protein kinase kinase 4 (MAP kinase kinase 4) (MAPKK 4) (EC 2.7.12.2) (JNK-activating kinase 1) (MAPK/ERK kinase 4) (MEK 4) (SAPK/ERK kinase 1) (SEK1) (Stress-activated protein kinase kinase 1) (SAPK kinase 1) (SAPKK-1) (SAPKK1) (c-Jun N-terminal kinase kinase 1) (JNKK),0.36
132,P00367,DHE3_HUMAN,"Glutamate dehydrogenase 1, mitochondrial (GDH 1) (EC 1.4.1.3)",0.35
133,Q96HY7,DHTK1_HUMAN,"Probable 2-oxoglutarate dehydrogenase E1 component DHKTD1, mitochondrial (EC 1.2.4.2) (Dehydrogenase E1 and transketolase domain-containing protein 1)",0.35
134,O43676,NDUB3_HUMAN,NADH dehydrogenase [ubiquinone] 1 beta subcomplex subunit 3 (Complex I-B12) (CI-B12) (NADH-ubiquinone oxidoreductase B12 subunit),0.35
135,P19801,AOC1_HUMAN,Amiloride-sensitive amine oxidase [copper-containing] (DAO) (Diamine oxidase) (EC 1.4.3.22) (Amiloride-binding protein 1) (Amine oxidase copper domain-containing protein 1) (Histaminase) (Kidney amine oxidase) (KAO),0.35
136,Q8N465,D2HDH_HUMAN,"D-2-hydroxyglutarate dehydrogenase, mitochondrial (EC 1.1.99.-)",0.34
137,Q9BRT2,UQCC2_HUMAN,Ubiquinol-cytochrome-c reductase complex assembly factor 2 (Breast cancer-associated protein SGA-81M) (Mitochondrial nucleoid factor 1) (Mitochondrial protein M19),0.34
138,Q9NRP4,SDHF3_HUMAN,"Succinate dehydrogenase assembly factor 3, mitochondrial (SDH assembly factor 3) (SDHAF3)",0.33
139,Q8WUY8,NAT14_HUMAN,N-acetyltransferase 14 (EC 2.3.1.-) (K562 cell-derived leucine-zipper-like protein 1),0.33
140,Q9NRD9,DUOX1_HUMAN,Dual oxidase 1 (EC 1.11.1.-) (EC 1.6.3.1) (Large NOX 1) (Long NOX 1) (NADPH thyroid oxidase 1) (Thyroid oxidase 1),0.33
141,Q96CU9,FXRD1_HUMAN,FAD-dependent oxidoreductase domain-containing protein 1 (EC 1.-.-.-),0.33
142,Q7Z5J1,DHI1L_HUMAN,Hydroxysteroid 11-beta-dehydrogenase 1-like protein (EC 1.1.1.-) (11-beta-hydroxysteroid dehydrogenase type 3) (11-DH3) (11-beta-HSD3) (Short chain dehydrogenase/reductase family 26C member 2) (Short-chain dehydrogenase/reductase 10),0.32
143,O00182,LEG9_HUMAN,Galectin-9 (Gal-9) (Ecalectin) (Tumor antigen HOM-HD-21),0.32
144,P37231,PPARG_HUMAN,Peroxisome proliferator-activated receptor gamma (PPAR-gamma) (Nuclear receptor subfamily 1 group C member 3),0.32
145,P14679,TYRO_HUMAN,Tyrosinase (EC 1.14.18.1) (LB24-AB) (Monophenol monooxygenase) (SK29-AB) (Tumor rejection antigen AB),0.32
146,O00391,QSOX1_HUMAN,Sulfhydryl oxidase 1 (hQSOX) (EC 1.8.3.2) (Quiescin Q6),0.32
147,P07202,PERT_HUMAN,Thyroid peroxidase (TPO) (EC 1.11.1.8),0.32
148,P12694,ODBA_HUMAN,"2-oxoisovalerate dehydrogenase subunit alpha, mitochondrial (EC 1.2.4.4) (Branched-chain alpha-keto acid dehydrogenase E1 component alpha chain) (BCKDE1A) (BCKDH E1-alpha)",0.32
149,P47929,LEG7_HUMAN,Galectin-7 (Gal-7) (HKL-14) (PI7) (p53-induced gene 1 protein),0.31
150,Q8IZ83,A16A1_HUMAN,Aldehyde dehydrogenase family 16 member A1,0.31
151,O15503,INSI1_HUMAN,Insulin-induced gene 1 protein (INSIG-1),0.31
152,Q96C36,P5CR2_HUMAN,Pyrroline-5-carboxylate reductase 2 (P5C reductase 2) (P5CR 2) (EC 1.5.1.2),0.31
153,P47985,UCRI_HUMAN,"Cytochrome b-c1 complex subunit Rieske, mitochondrial (EC 7.1.1.8) (Complex III subunit 5) (Cytochrome b-c1 complex subunit 5) (Rieske iron-sulfur protein) (RISP) (Rieske protein UQCRFS1) (Ubiquinol-cytochrome c reductase iron-sulfur subunit) [Cleaved into: Cytochrome b-c1 complex subunit 9 (Su9) (Subunit 9) (8 kDa subunit 9) (Complex III subunit IX) (Cytochrome b-c1 complex subunit 11) (UQCRFS1 mitochondrial targeting sequence) (UQCRFS1 MTS) (Ubiquinol-cytochrome c reductase 8 kDa protein)]",0.31
154,P32322,P5CR1_HUMAN,"Pyrroline-5-carboxylate reductase 1, mitochondrial (P5C reductase 1) (P5CR 1) (EC 1.5.1.2)",0.3
155,Q5T2L2,AKCL1_HUMAN,Putative aldo-keto reductase family 1 member C8 (Aldo-keto reductase family 1 member C-like protein 1) (EC 1.1.1.-),0.3
156,P36957,ODO2_HUMAN,"Dihydrolipoyllysine-residue succinyltransferase component of 2-oxoglutarate dehydrogenase complex, mitochondrial (EC 2.3.1.61) (2-oxoglutarate dehydrogenase complex component E2) (OGDC-E2) (Dihydrolipoamide succinyltransferase component of 2-oxoglutarate dehydrogenase complex) (E2K)",0.3
157,Q6JQN1,ACD10_HUMAN,Acyl-CoA dehydrogenase family member 10 (ACAD-10) (EC 1.3.99.-),0.3
158,O15528,CP27B_HUMAN,"25-hydroxyvitamin D-1 alpha hydroxylase, mitochondrial (EC 1.14.15.18) (25-OHD-1 alpha-hydroxylase) (25-hydroxyvitamin D(3) 1-alpha-hydroxylase) (VD3 1A hydroxylase) (Calcidiol 1-monooxygenase) (Cytochrome P450 subfamily XXVIIB polypeptide 1) (Cytochrome P450C1 alpha) (Cytochrome P450VD1-alpha) (Cytochrome p450 27B1)",0.3
159,P40926,MDHM_HUMAN,"Malate dehydrogenase, mitochondrial (EC 1.1.1.37)",0.3
160,Q9UF12,HYPDH_HUMAN,Hydroxyproline dehydrogenase (HYPDH) (EC 1.5.5.3) (Kidney and liver proline oxidase 1) (HsPOX1) (Probable proline dehydrogenase 2) (EC 1.5.5.2) (Probable proline oxidase 2),0.3
