Rank,UniProt_ID,STRING_ID,Protein_Names,pLLPS_Score
146,Q8N0X4,CLYBL_HUMAN,"Citramalyl-CoA lyase, mitochondrial (EC 4.1.3.25) ((3S)-malyl-CoA thioesterase) (EC 3.1.2.30) (Beta-methylmalate synthase) (EC 2.3.3.-) (Citrate lyase subunit beta-like protein) (Citrate lyase beta-like) (Malate synthase) (EC 2.3.3.9)",0.2
147,Q9NZL9,MAT2B_HUMAN,Methionine adenosyltransferase 2 subunit beta (Methionine adenosyltransferase II beta) (MAT II beta) (Putative dTDP-4-keto-6-deoxy-D-glucose 4-reductase),0.2
148,Q96G23,CERS2_HUMAN,Ceramide synthase 2 (CerS2) (EC 2.3.1.-) (LAG1 longevity assurance homolog 2) (SP260) (Sphingosine N-acyltransferase CERS2) (EC 2.3.1.24) (Tumor metastasis-suppressor gene 1 protein),0.2
149,Q5JPH6,SYEM_HUMAN,"Probable glutamate--tRNA ligase, mitochondrial (EC 6.1.1.17) (Glutamyl-tRNA synthetase) (GluRS)",0.2
150,Q08AH3,ACS2A_HUMAN,"Acyl-coenzyme A synthetase ACSM2A, mitochondrial (EC 6.2.1.2) (Acyl-CoA synthetase medium-chain family member 2A) (Benzoate--CoA ligase) (EC 6.2.1.25) (Butyrate--CoA ligase 2A) (Butyryl-coenzyme A synthetase 2A) (Middle-chain acyl-CoA synthetase 2A)",0.2
151,P14854,CX6B1_HUMAN,Cytochrome c oxidase subunit 6B1 (Cytochrome c oxidase subunit VIb isoform 1) (COX VIb-1),0.2
152,P23141,EST1_HUMAN,Liver carboxylesterase 1 (Acyl-coenzyme A:cholesterol acyltransferase) (ACAT) (Brain carboxylesterase hBr1) (Carboxylesterase 1) (CE-1) (hCE-1) (EC 3.1.1.1) (Cholesteryl ester hydrolase) (CEH) (Cocaine carboxylesterase) (Egasyn) (HMSE) (Methylumbelliferyl-acetate deacetylase 1) (EC 3.1.1.56) (Monocyte/macrophage serine esterase) (Retinyl ester hydrolase) (REH) (Serine esterase 1) (Triacylglycerol hydrolase) (TGH),0.2
153,Q9UDR5,AASS_HUMAN,"Alpha-aminoadipic semialdehyde synthase, mitochondrial (LKR/SDH) [Includes: Lysine ketoglutarate reductase (LKR) (LOR) (EC 1.5.1.8); Saccharopine dehydrogenase (SDH) (EC 1.5.1.9)]",0.2
154,P49588,SYAC_HUMAN,"Alanine--tRNA ligase, cytoplasmic (EC 6.1.1.7) (Alanyl-tRNA synthetase) (AlaRS) (Renal carcinoma antigen NY-REN-42)",0.2
155,P09669,COX6C_HUMAN,Cytochrome c oxidase subunit 6C (Cytochrome c oxidase polypeptide VIc),0.2
156,Q9NV66,TYW1_HUMAN,S-adenosyl-L-methionine-dependent tRNA 4-demethylwyosine synthase TYW1 (EC 4.1.3.44) (Radical S-adenosyl methionine and flavodoxin domain-containing protein 1) (tRNA wybutosine-synthesizing protein 1 homolog) (tRNA-yW-synthesizing protein),0.2
157,P54840,GYS2_HUMAN,"Glycogen [starch] synthase, liver (EC 2.4.1.11)",0.2
158,P25705,ATPA_HUMAN,"ATP synthase subunit alpha, mitochondrial (ATP synthase F1 subunit alpha)",0.2
159,Q9ULI2,RIMKB_HUMAN,Beta-citrylglutamate synthase B (EC 6.3.1.17) (N-acetyl-aspartylglutamate synthetase B) (NAAG synthetase B) (NAAGS) (EC 6.3.2.41) (Ribosomal protein S6 modification-like protein B),0.2
160,A5YM72,CRNS1_HUMAN,Carnosine synthase 1 (EC 6.3.2.11) (ATP-grasp domain-containing protein 1),0.2
161,Q16873,LTC4S_HUMAN,Leukotriene C4 synthase (LTC4 synthase) (EC 4.4.1.20) (Glutathione S-transferase LTC4) (EC 2.5.1.-) (Leukotriene-C(4) synthase) (Leukotriene-C4 synthase),0.19
162,P49915,GUAA_HUMAN,GMP synthase [glutamine-hydrolyzing] (EC 6.3.5.2) (GMP synthetase) (Glutamine amidotransferase),0.19
163,Q96QU6,1A1L1_HUMAN,1-aminocyclopropane-1-carboxylate synthase-like protein 1 (ACC synthase-like protein 1),0.19
164,Q9NR45,SIAS_HUMAN,Sialic acid synthase (N-acetylneuraminate synthase) (EC 2.5.1.56) (N-acetylneuraminate-9-phosphate synthase) (EC 2.5.1.57) (N-acetylneuraminic acid phosphate synthase) (N-acetylneuraminic acid synthase),0.19
165,Q6YFQ2,CX6B2_HUMAN,"Cytochrome c oxidase subunit 6B2 (Cancer/testis antigen 59) (CT59) (Cytochrome c oxidase subunit VIb isoform 2) (COX VIb-2) (Cytochrome c oxidase subunit VIb, testis-specific isoform)",0.19
166,Q6NUN0,ACSM5_HUMAN,"Acyl-coenzyme A synthetase ACSM5, mitochondrial (EC 6.2.1.2) (Acyl-CoA synthetase medium-chain family member 5)",0.19
167,P20674,COX5A_HUMAN,"Cytochrome c oxidase subunit 5A, mitochondrial (Cytochrome c oxidase polypeptide Va)",0.19
168,Q53FZ2,ACSM3_HUMAN,"Acyl-coenzyme A synthetase ACSM3, mitochondrial (EC 6.2.1.2) (Acyl-CoA synthetase medium-chain family member 3) (Butyrate--CoA ligase 3) (Butyryl-coenzyme A synthetase 3) (Middle-chain acyl-CoA synthetase 3) (Propionate--CoA ligase) (EC 6.2.1.17) (Protein SA homolog)",0.19
169,P00973,OAS1_HUMAN,2'-5'-oligoadenylate synthase 1 ((2-5')oligo(A) synthase 1) (2-5A synthase 1) (EC 2.7.7.84) (E18/E16) (p46/p42 OAS),0.19
170,Q3MIT2,PUS10_HUMAN,tRNA pseudouridine synthase Pus10 (Hup10) (EC 5.4.99.25) (Coiled-coil domain-containing protein 139) (tRNA pseudouridine 55 synthase) (Psi55 synthase) (tRNA pseudouridylate synthase) (tRNA-uridine isomerase),0.19
171,P00414,COX3_HUMAN,Cytochrome c oxidase subunit 3 (EC 7.1.1.9) (Cytochrome c oxidase polypeptide III),0.19
172,Q07817,B2CL1_HUMAN,Bcl-2-like protein 1 (Bcl2-L-1) (Apoptosis regulator Bcl-X),0.19
173,P46976,GLYG_HUMAN,Glycogenin-1 (GN-1) (GN1) (EC 2.4.1.186),0.19
174,Q96FN9,DTD2_HUMAN,D-aminoacyl-tRNA deacylase 2 (EC 3.1.1.96) (Animalia-specific tRNA deacylase) (ATD) (D-tyrosyl-tRNA(Tyr) deacylase 2) (L-alanyl-tRNA deacylase),0.19
175,Q6PCE3,PGM2L_HUMAN,"Glucose 1,6-bisphosphate synthase (EC 2.7.1.106) (PMMLP) (Phosphoglucomutase-2-like 1)",0.19
176,Q5VTU8,AT5EL_HUMAN,"ATP synthase subunit epsilon-like protein, mitochondrial (ATP synthase F1 subunit epsilon pseudogene 2)",0.19
177,Q86V21,AACS_HUMAN,Acetoacetyl-CoA synthetase (EC 6.2.1.16) (Acyl-CoA synthetase family member 1) (Protein sur-5 homolog),0.19
178,Q6NUM6,TYW1B_HUMAN,S-adenosyl-L-methionine-dependent tRNA 4-demethylwyosine synthase TYW1B (EC 4.1.3.44) (Radical S-adenosyl methionine and flavodoxin domain-containing protein 2) (tRNA wybutosine-synthesizing protein 1 homolog B),0.19
179,Q01581,HMCS1_HUMAN,"Hydroxymethylglutaryl-CoA synthase, cytoplasmic (HMG-CoA synthase) (EC 2.3.3.10) (3-hydroxy-3-methylglutaryl coenzyme A synthase)",0.19
180,P49366,DHYS_HUMAN,Deoxyhypusine synthase (DHS) (EC 2.5.1.46),0.18
181,P56192,SYMC_HUMAN,"Methionine--tRNA ligase, cytoplasmic (EC 6.1.1.10) (Methionyl-tRNA synthetase) (MetRS)",0.18
182,P24311,COX7B_HUMAN,"Cytochrome c oxidase subunit 7B, mitochondrial (Cytochrome c oxidase polypeptide VIIb)",0.18
183,O95363,SYFM_HUMAN,"Phenylalanine--tRNA ligase, mitochondrial (EC 6.1.1.20) (Phenylalanyl-tRNA synthetase) (PheRS)",0.18
184,P35520,CBS_HUMAN,Cystathionine beta-synthase (EC 4.2.1.22) (Beta-thionase) (Serine sulfhydrase),0.18
185,P0DN79,CBSL_HUMAN,Cystathionine beta-synthase-like protein (EC 4.2.1.22) (Beta-thionase) (Serine sulfhydrase),0.18
186,Q9P2J5,SYLC_HUMAN,"Leucine--tRNA ligase, cytoplasmic (EC 6.1.1.4) (Leucyl-tRNA synthetase) (LeuRS)",0.18
187,Q06055,AT5G2_HUMAN,"ATP synthase F(0) complex subunit C2, mitochondrial (ATP synthase lipid-binding protein) (ATP synthase membrane subunit c locus 2) (ATP synthase proteolipid P2) (ATP synthase proton-transporting mitochondrial F(0) complex subunit C2) (ATPase protein 9) (ATPase subunit c)",0.18
188,Q13155,AIMP2_HUMAN,Aminoacyl tRNA synthase complex-interacting multifunctional protein 2 (Multisynthase complex auxiliary component p38) (Protein JTV-1),0.18
189,P78540,ARGI2_HUMAN,"Arginase-2, mitochondrial (EC 3.5.3.1) (Arginase II) (Kidney-type arginase) (Non-hepatic arginase) (Type II arginase)",0.18
190,Q08AH1,ACSM1_HUMAN,"Acyl-coenzyme A synthetase ACSM1, mitochondrial (EC 6.2.1.2) (Acyl-CoA synthetase medium-chain family member 1) (Benzoate--CoA ligase) (EC 6.2.1.25) (Butyrate--CoA ligase 1) (Butyryl-coenzyme A synthetase 1) (Lipoate-activating enzyme) (Middle-chain acyl-CoA synthetase 1) (Xenobiotic/medium-chain fatty acid-CoA ligase HXM-B)",0.18
191,Q96IX5,ATPMD_HUMAN,"ATP synthase membrane subunit DAPIT, mitochondrial (Diabetes-associated protein in insulin-sensitive tissues) (HCV F-transactivated protein 2) (Up-regulated during skeletal muscle growth protein 5)",0.18
192,Q9Y2Z4,SYYM_HUMAN,"Tyrosine--tRNA ligase, mitochondrial (EC 6.1.1.1) (Tyrosyl-tRNA synthetase) (TyrRS)",0.18
193,Q99707,METH_HUMAN,Methionine synthase (MS) (EC 2.1.1.13) (5-methyltetrahydrofolate--homocysteine methyltransferase) (Cobalamin-dependent methionine synthase) (Vitamin-B12 dependent methionine synthase),0.18
194,O00483,NDUA4_HUMAN,Cytochrome c oxidase subunit NDUFA4 (Complex I-MLRQ) (CI-MLRQ) (NADH-ubiquinone oxidoreductase MLRQ subunit),0.17
195,P30520,PURA2_HUMAN,"Adenylosuccinate synthetase isozyme 2 (AMPSase 2) (AdSS 2) (EC 6.3.4.4) (Adenylosuccinate synthetase, acidic isozyme) (Adenylosuccinate synthetase, liver isozyme) (L-type adenylosuccinate synthetase) (IMP--aspartate ligase 2)",0.17
196,P00403,COX2_HUMAN,Cytochrome c oxidase subunit 2 (EC 7.1.1.9) (Cytochrome c oxidase polypeptide II),0.17
197,A2RTX5,SYTC2_HUMAN,"Threonine--tRNA ligase 2, cytoplasmic (EC 6.1.1.3) (Threonyl-tRNA synthetase) (ThrRS) (Threonyl-tRNA synthetase protein 3)",0.17
198,P47897,SYQ_HUMAN,Glutamine--tRNA ligase (EC 6.1.1.18) (Glutaminyl-tRNA synthetase) (GlnRS),0.17
199,P48449,LSS_HUMAN,"Lanosterol synthase (EC 5.4.99.7) (2,3-epoxysqualene--lanosterol cyclase) (Oxidosqualene--lanosterol cyclase) (OSC) (hOSC)",0.17
200,O95340,PAPS2_HUMAN,Bifunctional 3'-phosphoadenosine 5'-phosphosulfate synthase 2 (PAPS synthase 2) (PAPSS 2) (Sulfurylase kinase 2) (SK 2) (SK2) [Includes: Sulfate adenylyltransferase (EC 2.7.7.4) (ATP-sulfurylase) (Sulfate adenylate transferase) (SAT); Adenylyl-sulfate kinase (EC 2.7.1.25) (3'-phosphoadenosine-5'-phosphosulfate synthase) (APS kinase) (Adenosine-5'-phosphosulfate 3'-phosphotransferase) (Adenylylsulfate 3'-phosphotransferase)],0.17
201,P48047,ATPO_HUMAN,"ATP synthase subunit O, mitochondrial (ATP synthase peripheral stalk subunit OSCP) (Oligomycin sensitivity conferral protein) (OSCP)",0.17
202,O43766,LIAS_HUMAN,"Lipoyl synthase, mitochondrial (EC 2.8.1.8) (Lipoate synthase) (LS) (Lip-syn) (Lipoic acid synthase)",0.17
203,Q86XI6,PPR3B_HUMAN,Protein phosphatase 1 regulatory subunit 3B (Hepatic glycogen-targeting protein phosphatase 1 regulatory subunit GL) (Protein phosphatase 1 regulatory subunit 4) (PP1 subunit R4) (Protein phosphatase 1 subunit GL) (PTG),0.17
204,P54868,HMCS2_HUMAN,"Hydroxymethylglutaryl-CoA synthase, mitochondrial (HMG-CoA synthase) (EC 2.3.3.10) (3-hydroxy-3-methylglutaryl coenzyme A synthase)",0.17
205,P48637,GSHB_HUMAN,Glutathione synthetase (GSH synthetase) (GSH-S) (EC 6.3.2.3) (Glutathione synthase),0.17
206,A6NEY8,PRXD1_HUMAN,Putative prolyl-tRNA synthetase associated domain-containing protein 1 (PrdX deacylase domain-containing protein 1) (Prolyl-tRNA synthetase associated domain-containing protein 1 pseudogene),0.17
207,O14949,QCR8_HUMAN,Cytochrome b-c1 complex subunit 8 (Complex III subunit 8) (Complex III subunit VIII) (Ubiquinol-cytochrome c reductase complex 9.5 kDa protein) (Ubiquinol-cytochrome c reductase complex ubiquinone-binding protein QP-C),0.16
208,Q8WXG1,RSAD2_HUMAN,"Radical S-adenosyl methionine domain-containing protein 2 (Cytomegalovirus-induced gene 5 protein) (Viperin) (Virus inhibitory protein, endoplasmic reticulum-associated, interferon-inducible)",0.16
209,P23219,PGH1_HUMAN,Prostaglandin G/H synthase 1 (EC 1.14.99.1) (Cyclooxygenase-1) (COX-1) (Prostaglandin H2 synthase 1) (PGH synthase 1) (PGHS-1) (PHS 1) (Prostaglandin-endoperoxide synthase 1),0.16
210,O95822,DCMC_HUMAN,"Malonyl-CoA decarboxylase, mitochondrial (MCD) (EC 4.1.1.9)",0.16
211,Q6PI48,SYDM_HUMAN,"Aspartate--tRNA ligase, mitochondrial (EC 6.1.1.12) (Aspartyl-tRNA synthetase) (AspRS)",0.16
212,A8MUP2,CSKMT_HUMAN,"Citrate synthase-lysine N-methyltransferase CSKMT, mitochondrial (CS-KMT) (EC 2.1.1.-) (Methyltransferase-like protein 12, mitochondrial)",0.16
213,Q96I99,SUCB2_HUMAN,"Succinate--CoA ligase [GDP-forming] subunit beta, mitochondrial (EC 6.2.1.4) (GTP-specific succinyl-CoA synthetase subunit beta) (G-SCS) (GTPSCS) (Succinyl-CoA synthetase beta-G chain) (SCS-betaG)",0.16
214,O14684,PTGES_HUMAN,Prostaglandin E synthase (EC 5.3.99.3) (Microsomal glutathione S-transferase 1-like 1) (MGST1-L1) (Microsomal prostaglandin E synthase 1) (MPGES-1) (p53-induced gene 12 protein),0.16
215,Q13630,FCL_HUMAN,"GDP-L-fucose synthase (EC 1.1.1.271) (GDP-4-keto-6-deoxy-D-mannose-3,5-epimerase-4-reductase) (Protein FX) (Red cell NADP(H)-binding protein) (Short-chain dehydrogenase/reductase family 4E member 1)",0.16
216,P27544,CERS1_HUMAN,Ceramide synthase 1 (CerS1) (EC 2.3.1.-) (LAG1 longevity assurance homolog 1) (Longevity assurance gene 1 protein homolog 1) (Protein UOG-1),0.16
217,P54886,P5CS_HUMAN,Delta-1-pyrroline-5-carboxylate synthase (P5CS) (Aldehyde dehydrogenase family 18 member A1) [Includes: Glutamate 5-kinase (GK) (EC 2.7.2.11) (Gamma-glutamyl kinase); Gamma-glutamyl phosphate reductase (GPR) (EC 1.2.1.41) (Glutamate-5-semialdehyde dehydrogenase) (Glutamyl-gamma-semialdehyde dehydrogenase)],0.16
218,Q15646,OASL_HUMAN,2'-5'-oligoadenylate synthase-like protein (2'-5'-OAS-related protein) (2'-5'-OAS-RP) (59 kDa 2'-5'-oligoadenylate synthase-like protein) (Thyroid receptor-interacting protein 14) (TR-interacting protein 14) (TRIP-14) (p59 OASL) (p59OASL),0.16
219,Q9NY97,B3GN2_HUMAN,"N-acetyllactosaminide beta-1,3-N-acetylglucosaminyltransferase 2 (EC 2.4.1.149) (Beta-1,3-N-acetylglucosaminyltransferase 1) (BGnT-1) (Beta-1,3-Gn-T1) (Beta3Gn-T1) (Beta-1,3-galactosyltransferase 7) (Beta-1,3-GalTase 7) (Beta3Gal-T7) (Beta3GalT7) (b3Gal-T7) (Beta-3-Gx-T7) (UDP-Gal:beta-GlcNAc beta-1,3-galactosyltransferase 7) (UDP-GlcNAc:betaGal beta-1,3-N-acetylglucosaminyltransferase 2) (BGnT-2) (Beta-1,3-Gn-T2) (Beta-1,3-N-acetylglucosaminyltransferase 2) (Beta3Gn-T2) (UDP-galactose:beta-N-acetylglucosamine beta-1,3-galactosyltransferase 7)",0.16
220,Q8N142,PURA1_HUMAN,"Adenylosuccinate synthetase isozyme 1 (AMPSase 1) (AdSS 1) (EC 6.3.4.4) (Adenylosuccinate synthetase, basic isozyme) (Adenylosuccinate synthetase, muscle isozyme) (M-type adenylosuccinate synthetase) (Adenylosuccinate synthetase-like 1) (AdSSL1) (IMP--aspartate ligase 1)",0.16
221,Q9UGM6,SYWM_HUMAN,"Tryptophan--tRNA ligase, mitochondrial (EC 6.1.1.2) ((Mt)TrpRS) (Tryptophanyl-tRNA synthetase) (TrpRS)",0.16
222,Q9H0K6,PUS7L_HUMAN,Pseudouridylate synthase 7 homolog-like protein (EC 5.4.99.-),0.16
223,Q9HA77,SYCM_HUMAN,"Probable cysteine--tRNA ligase, mitochondrial (EC 6.1.1.16) (Cysteinyl-tRNA synthetase) (CysRS)",0.15
224,Q6ZPD8,DG2L6_HUMAN,Diacylglycerol O-acyltransferase 2-like protein 6 (EC 2.3.1.-) (Diacylglycerol O-acyltransferase candidate 3) (hDC3),0.15
225,O43252,PAPS1_HUMAN,Bifunctional 3'-phosphoadenosine 5'-phosphosulfate synthase 1 (PAPS synthase 1) (PAPSS 1) (Sulfurylase kinase 1) (SK 1) (SK1) [Includes: Sulfate adenylyltransferase (EC 2.7.7.4) (ATP-sulfurylase) (Sulfate adenylate transferase) (SAT); Adenylyl-sulfate kinase (EC 2.7.1.25) (3'-phosphoadenosine-5'-phosphosulfate synthase) (APS kinase) (Adenosine-5'-phosphosulfate 3'-phosphotransferase) (Adenylylsulfate 3'-phosphotransferase)],0.15
226,Q86YJ6,THNS2_HUMAN,Threonine synthase-like 2 (TSH2) (EC 4.2.3.-) (Secreted osteoclastogenic factor of activated T-cells) (SOFAT),0.15
227,Q6P461,ACSM6_HUMAN,"Acyl-coenzyme A synthetase ACSM6, mitochondrial (EC 6.2.1.2) (Acyl-CoA synthetase medium-chain family member 6)",0.15
228,P10746,HEM4_HUMAN,Uroporphyrinogen-III synthase (UROIIIS) (UROS) (EC 4.2.1.75) (Hydroxymethylbilane hydrolyase [cyclizing]) (Uroporphyrinogen-III cosynthase),0.15
229,Q9UQK1,PPR3C_HUMAN,Protein phosphatase 1 regulatory subunit 3C (Protein phosphatase 1 regulatory subunit 5) (PP1 subunit R5) (Protein targeting to glycogen) (PTG),0.15
230,P10176,COX8A_HUMAN,"Cytochrome c oxidase subunit 8A, mitochondrial (Cytochrome c oxidase polypeptide VIII-liver/heart) (Cytochrome c oxidase subunit 8-2)",0.15
231,Q86SQ9,DHDDS_HUMAN,Dehydrodolichyl diphosphate synthase complex subunit DHDDS (EC 2.5.1.87) (Cis-isoprenyltransferase) (CIT) (Cis-IPTase) (Cis-prenyltransferase subunit hCIT) (Epididymis tissue protein Li 189m),0.15
232,P24557,THAS_HUMAN,Thromboxane-A synthase (TXA synthase) (TXS) (EC 5.3.99.5) (Cytochrome P450 5A1),0.15
233,O96007,MOC2B_HUMAN,Molybdopterin synthase catalytic subunit (EC 2.8.1.12) (MOCO1-B) (Molybdenum cofactor synthesis protein 2 large subunit) (Molybdenum cofactor synthesis protein 2B) (MOCS2B) (Molybdopterin-synthase large subunit) (MPT synthase large subunit),0.15
234,P48200,IREB2_HUMAN,Iron-responsive element-binding protein 2 (IRE-BP 2) (Iron regulatory protein 2) (IRP2),0.15
235,Q15031,SYLM_HUMAN,"Probable leucine--tRNA ligase, mitochondrial (EC 6.1.1.4) (Leucyl-tRNA synthetase) (LeuRS)",0.15
236,Q8IU89,CERS3_HUMAN,Ceramide synthase 3 (CerS3) (EC 2.3.1.-) (Dihydroceramide synthase 3) (LAG1 longevity assurance homolog 3) (Sphingosine N-acyltransferase CERS3) (EC 2.3.1.24),0.15
237,Q00535,CDK5_HUMAN,Cyclin-dependent-like kinase 5 (EC 2.7.11.1) (Cell division protein kinase 5) (Serine/threonine-protein kinase PSSALRE) (Tau protein kinase II catalytic subunit) (TPKII catalytic subunit),0.15
238,P01562,IFNA1_HUMAN,Interferon alpha-1/13 (IFN-alpha-1/13) (Interferon alpha-D) (LeIF D),0.15
239,P00846,ATP6_HUMAN,ATP synthase subunit a (F-ATPase protein 6),0.15
240,Q9NV23,SAST_HUMAN,"S-acyl fatty acid synthase thioesterase, medium chain (EC 3.1.2.14) (Augmented in rheumatoid arthritis 1) (AURA1) (Oleoyl-ACP hydrolase) (Thioesterase 2) (TE2) (Thioesterase II) (Thioesterase domain-containing protein 1)",0.14
241,Q86YH6,DLP1_HUMAN,Decaprenyl-diphosphate synthase subunit 2 (EC 2.5.1.91) (All-trans-decaprenyl-diphosphate synthase subunit 2) (Candidate tumor suppressor protein) (Decaprenyl pyrophosphate synthase subunit 2),0.14
242,P12081,HARS1_HUMAN,"Histidine--tRNA ligase, cytoplasmic (EC 6.1.1.21) (Histidyl-tRNA synthetase) (HisRS)",0.14
243,P11172,UMPS_HUMAN,Uridine 5'-monophosphate synthase (UMP synthase) [Includes: Orotate phosphoribosyltransferase (OPRT) (OPRTase) (EC 2.4.2.10); Orotidine 5'-phosphate decarboxylase (ODC) (EC 4.1.1.23) (OMPdecase)],0.14
244,O75947,ATP5H_HUMAN,"ATP synthase subunit d, mitochondrial (ATPase subunit d) (ATP synthase peripheral stalk subunit d)",0.14
245,Q96E22,NGBR_HUMAN,Dehydrodolichyl diphosphate synthase complex subunit NUS1 (EC 2.5.1.87) (Cis-prenyltransferase subunit NgBR) (Nogo-B receptor) (NgBR) (Nuclear undecaprenyl pyrophosphate synthase 1 homolog),0.14
246,P14927,QCR7_HUMAN,Cytochrome b-c1 complex subunit 7 (Complex III subunit 7) (Complex III subunit VII) (QP-C) (Ubiquinol-cytochrome c reductase complex 14 kDa protein),0.14
247,Q8TD46,MO2R1_HUMAN,Cell surface glycoprotein CD200 receptor 1 (CD200 cell surface glycoprotein receptor) (Cell surface glycoprotein OX2 receptor 1),0.14
248,P32321,DCTD_HUMAN,Deoxycytidylate deaminase (EC 3.5.4.12) (dCMP deaminase),0.14
249,P31327,CPSM_HUMAN,"Carbamoyl-phosphate synthase [ammonia], mitochondrial (EC 6.3.4.16) (Carbamoyl-phosphate synthetase I) (CPSase I)",0.14
250,Q9NWL6,ASND1_HUMAN,Asparagine synthetase domain-containing protein 1 (HCV NS3-transactivated protein 1),0.14
251,Q6IA69,NADE_HUMAN,Glutamine-dependent NAD(+) synthetase (EC 6.3.5.1) (NAD(+) synthase [glutamine-hydrolyzing]) (NAD(+) synthetase),0.14
252,P49590,SYHM_HUMAN,"Histidine--tRNA ligase, mitochondrial (EC 6.1.1.21) (Histidine--tRNA ligase-like) (Histidyl-tRNA synthetase) (HisRS)",0.14
253,P15954,COX7C_HUMAN,"Cytochrome c oxidase subunit 7C, mitochondrial (Cytochrome c oxidase polypeptide VIIc)",0.14
254,O60762,DPM1_HUMAN,Dolichol-phosphate mannosyltransferase subunit 1 (EC 2.4.1.83) (Dolichol-phosphate mannose synthase subunit 1) (DPM synthase subunit 1) (Dolichyl-phosphate beta-D-mannosyltransferase subunit 1) (Mannose-P-dolichol synthase subunit 1) (MPD synthase subunit 1),0.14
255,P14324,FPPS_HUMAN,"Farnesyl pyrophosphate synthase (FPP synthase) (FPS) (EC 2.5.1.10) ((2E,6E)-farnesyl diphosphate synthase) (Dimethylallyltranstransferase) (EC 2.5.1.1) (Farnesyl diphosphate synthase) (Geranyltranstransferase)",0.14
256,Q9H2P9,DPH5_HUMAN,Diphthine methyl ester synthase (EC 2.1.1.314) (Diphthamide biosynthesis methyltransferase),0.14
257,Q14558,KPRA_HUMAN,Phosphoribosyl pyrophosphate synthase-associated protein 1 (PRPP synthase-associated protein 1) (39 kDa phosphoribosypyrophosphate synthase-associated protein) (PAP39),0.14
258,P52788,SPSY_HUMAN,Spermine synthase (SPMSY) (EC 2.5.1.22) (Spermidine aminopropyltransferase),0.14
259,Q86WN2,IFNE_HUMAN,Interferon epsilon (IFN-epsilon) (Interferon epsilon-1),0.13
260,P41252,SYIC_HUMAN,"Isoleucine--tRNA ligase, cytoplasmic (EC 6.1.1.5) (Isoleucyl-tRNA synthetase) (IRS) (IleRS)",0.13
261,P48651,PTSS1_HUMAN,Phosphatidylserine synthase 1 (PSS-1) (PtdSer synthase 1) (EC 2.7.8.29) (Serine-exchange enzyme I),0.13
262,P01569,IFNA5_HUMAN,Interferon alpha-5 (IFN-alpha-5) (Interferon alpha-61) (Interferon alpha-G) (LeIF G),0.13
263,Q96I59,SYNM_HUMAN,"Probable asparagine--tRNA ligase, mitochondrial (EC 6.1.1.22) (Asparaginyl-tRNA synthetase) (AsnRS)",0.13
264,Q5T160,SYRM_HUMAN,"Probable arginine--tRNA ligase, mitochondrial (EC 6.1.1.19) (Arginyl-tRNA synthetase) (ArgRS)",0.13
265,Q9NPF4,OSGEP_HUMAN,Probable tRNA N6-adenosine threonylcarbamoyltransferase (EC 2.3.1.234) (N6-L-threonylcarbamoyladenine synthase) (t(6)A synthase) (O-sialoglycoprotein endopeptidase) (hOSGEP) (t(6)A37 threonylcarbamoyladenosine biosynthesis protein OSGEP) (tRNA threonylcarbamoyladenosine biosynthesis protein OSGEP),0.13
266,P32881,IFNA8_HUMAN,Interferon alpha-8 (IFN-alpha-8) (Interferon alpha-B) (LeIF B) (Interferon alpha-B2),0.13
267,Q7Z4Y8,AT5L2_HUMAN,"Putative ATP synthase subunit g 2, mitochondrial (ATPase subunit g 2) (ATP synthase membrane subunit g-like protein)",0.13
268,Q92839,HYAS1_HUMAN,Hyaluronan synthase 1 (EC 2.4.1.212) (Hyaluronate synthase 1) (Hyaluronic acid synthase 1) (HA synthase 1) (HuHAS1),0.13
269,Q9H4B0,OSGP2_HUMAN,"Probable tRNA N6-adenosine threonylcarbamoyltransferase, mitochondrial (EC 2.3.1.234) (N6-L-threonylcarbamoyladenine synthase) (t(6)A synthase) (O-sialoglycoprotein endopeptidase-like protein 1) (t(6)A37 threonylcarbamoyladenosine biosynthesis protein OSGEPL1) (tRNA threonylcarbamoyladenosine biosynthesis protein OSGEPL1)",0.13
270,Q9HD40,SPCS_HUMAN,O-phosphoseryl-tRNA(Sec) selenium transferase (EC 2.9.1.2) (Liver-pancreas antigen) (LP) (SLA-p35) (SLA/LP autoantigen) (Selenocysteine synthase) (Sec synthase) (Selenocysteinyl-tRNA(Sec) synthase) (Sep-tRNA:Sec-tRNA synthase) (SepSecS) (Soluble liver antigen) (SLA) (UGA suppressor tRNA-associated protein) (tRNA(Ser/Sec)-associated antigenic protein),0.13
271,P49773,HINT1_HUMAN,Histidine triad nucleotide-binding protein 1 (EC 3.-.-.-) (Adenosine 5'-monophosphoramidase) (Protein kinase C inhibitor 1) (Protein kinase C-interacting protein 1) (PKCI-1),0.13
272,P35354,PGH2_HUMAN,Prostaglandin G/H synthase 2 (EC 1.14.99.1) (Cyclooxygenase-2) (COX-2) (PHS II) (Prostaglandin H2 synthase 2) (PGH synthase 2) (PGHS-2) (Prostaglandin-endoperoxide synthase 2),0.13
273,P08243,ASNS_HUMAN,Asparagine synthetase [glutamine-hydrolyzing] (EC 6.3.5.4) (Cell cycle control protein TS11) (Glutamine-dependent asparagine synthetase),0.13
274,Q8TBF2,PXL2B_HUMAN,Prostamide/prostaglandin F synthase (Prostamide/PG F synthase) (Prostamide/PGF synthase) (EC 1.11.1.20) (Peroxiredoxin-like 2B) (Protein FAM213B),0.13
275,Q03393,PTPS_HUMAN,6-pyruvoyl tetrahydrobiopterin synthase (PTP synthase) (PTPS) (EC 4.2.3.12),0.13
276,Q8IYQ7,THNS1_HUMAN,Threonine synthase-like 1 (TSH1),0.13
277,P00395,COX1_HUMAN,Cytochrome c oxidase subunit 1 (EC 7.1.1.9) (Cytochrome c oxidase polypeptide I),0.13
278,P36542,ATPG_HUMAN,"ATP synthase subunit gamma, mitochondrial (ATP synthase F1 subunit gamma) (F-ATPase gamma subunit)",0.13
279,Q9P2X0,DPM3_HUMAN,Dolichol-phosphate mannosyltransferase subunit 3 (Dolichol-phosphate mannose synthase subunit 3) (DPM synthase subunit 3) (Dolichyl-phosphate beta-D-mannosyltransferase subunit 3) (Mannose-P-dolichol synthase subunit 3) (MPD synthase subunit 3) (Prostin-1),0.13
280,Q71RH2,TLC3B_HUMAN,Ceramide synthase (EC 2.3.1.-) (Protein FAM57B) (TLC domain-containing protein 3B),0.13
281,Q9HBL8,NMRL1_HUMAN,NmrA-like family domain-containing protein 1,0.13
282,O60256,KPRB_HUMAN,Phosphoribosyl pyrophosphate synthase-associated protein 2 (PRPP synthase-associated protein 2) (41 kDa phosphoribosypyrophosphate synthetase-associated protein) (PAP41),0.12
283,Q7L3T8,SYPM_HUMAN,"Probable proline--tRNA ligase, mitochondrial (EC 6.1.1.15) (Prolyl-tRNA synthetase) (ProRS)",0.12
284,O75964,ATP5L_HUMAN,"ATP synthase subunit g, mitochondrial (ATPase subunit g) (ATP synthase membrane subunit g)",0.12
285,Q9NSD9,SYFB_HUMAN,Phenylalanine--tRNA ligase beta subunit (EC 6.1.1.20) (Phenylalanyl-tRNA synthetase beta subunit) (PheRS),0.12
286,P24539,AT5F1_HUMAN,"ATP synthase F(0) complex subunit B1, mitochondrial (ATP synthase peripheral stalk-membrane subunit b) (ATP synthase proton-transporting mitochondrial F(0) complex subunit B1) (ATP synthase subunit b) (ATPase subunit b)",0.12
287,P09917,LOX5_HUMAN,Polyunsaturated fatty acid 5-lipoxygenase (EC 1.13.11.-) (Arachidonate 5-lipoxygenase) (5-LO) (5-lipoxygenase) (EC 1.13.11.34),0.12
288,P05014,IFNA4_HUMAN,Interferon alpha-4 (IFN-alpha-4) (Interferon alpha-4B) (Interferon alpha-76) (Interferon alpha-M1),0.12
289,P24310,CX7A1_HUMAN,"Cytochrome c oxidase subunit 7A1, mitochondrial (Cytochrome c oxidase subunit VIIa-heart) (Cytochrome c oxidase subunit VIIa-H) (Cytochrome c oxidase subunit VIIa-muscle) (Cytochrome c oxidase subunit VIIa-M)",0.12
290,P19623,SPEE_HUMAN,Spermidine synthase (SPDSY) (EC 2.5.1.16) (Putrescine aminopropyltransferase),0.12
291,Q96LT4,SAMD8_HUMAN,Sphingomyelin synthase-related protein 1 (SMSr) (EC 2.7.8.-) (Ceramide phosphoethanolamine synthase) (CPE synthase) (Sterile alpha motif domain-containing protein 8) (SAM domain-containing protein 8),0.12
292,P01568,IFN21_HUMAN,Interferon alpha-21 (IFN-alpha-21) (Interferon alpha-F) (LeIF F),0.12
