Rank,UniProt_ID,STRING_ID,Protein_Names,pLLPS_Score
293,O96033,MOC2A_HUMAN,Molybdopterin synthase sulfur carrier subunit (MOCO1-A) (Molybdenum cofactor synthesis protein 2 small subunit) (Molybdenum cofactor synthesis protein 2A) (MOCS2A) (Molybdopterin-synthase small subunit) (Sulfur carrier protein MOCS2A),0.12
294,P01571,IFN17_HUMAN,Interferon alpha-17 (IFN-alpha-17) (Interferon alpha-88) (Interferon alpha-I') (LeIF I) (Interferon alpha-T),0.12
295,P00709,LALBA_HUMAN,Alpha-lactalbumin (Lactose synthase B protein) (Lysozyme-like protein 7),0.12
296,O14957,QCR10_HUMAN,Cytochrome b-c1 complex subunit 10 (Complex III subunit 10) (Complex III subunit XI) (Ubiquinol-cytochrome c reductase complex 6.4 kDa protein),0.12
297,O95620,DUS4L_HUMAN,tRNA-dihydrouridine(20a/20b) synthase [NAD(P)+]-like (EC 1.3.1.-) (pp35) (tRNA-dihydrouridine synthase 4-like),0.12
298,Q9BYG0,B3GN5_HUMAN,"Lactosylceramide 1,3-N-acetyl-beta-D-glucosaminyltransferase (EC 2.4.1.206) (Lactotriaosylceramide synthase) (Lc(3)Cer synthase) (Lc3 synthase) (UDP-GlcNAc:beta-Gal beta-1,3-N-acetylglucosaminyltransferase 5) (BGnT-5) (Beta-1,3-Gn-T5) (Beta-1,3-N-acetylglucosaminyltransferase 5) (Beta3Gn-T5)",0.12
299,Q92819,HYAS2_HUMAN,Hyaluronan synthase 2 (EC 2.4.1.212) (Hyaluronate synthase 2) (Hyaluronic acid synthase 2) (HA synthase 2),0.12
300,O00219,HYAS3_HUMAN,Hyaluronan synthase 3 (EC 2.4.1.212) (Hyaluronate synthase 3) (Hyaluronic acid synthase 3) (HA synthase 3),0.12
301,P31930,QCR1_HUMAN,"Cytochrome b-c1 complex subunit 1, mitochondrial (Complex III subunit 1) (Core protein I) (Ubiquinol-cytochrome-c reductase complex core protein 1)",0.11
302,P54136,SYRC_HUMAN,"Arginine--tRNA ligase, cytoplasmic (EC 6.1.1.19) (Arginyl-tRNA synthetase) (ArgRS)",0.11
303,O14975,S27A2_HUMAN,"Very long-chain acyl-CoA synthetase (VLACS) (VLCS) (EC 6.2.1.-) (Arachidonate--CoA ligase) (EC 6.2.1.15) (Fatty acid transport protein 2) (FATP-2) (Fatty-acid-coenzyme A ligase, very long-chain 1) (Long-chain-fatty-acid--CoA ligase) (EC 6.2.1.3) (Phytanate--CoA ligase) (EC 6.2.1.24) (Solute carrier family 27 member 2) (THCA-CoA ligase) (EC 6.2.1.7) (Very long-chain-fatty-acid-CoA ligase)",0.11
304,P56381,ATP5E_HUMAN,"ATP synthase subunit epsilon, mitochondrial (ATPase subunit epsilon) (ATP synthase F1 subunit epsilon)",0.11
305,P56134,ATPK_HUMAN,"ATP synthase subunit f, mitochondrial (ATP synthase membrane subunit f)",0.11
306,Q6P4H8,ACKMT_HUMAN,ATP synthase subunit C lysine N-methyltransferase (EC 2.1.1.-) (Protein N-lysine methyltransferase FAM173B) (hFAM173B),0.11
307,P01566,IFN10_HUMAN,Interferon alpha-10 (IFN-alpha-10) (Interferon alpha-6L) (Interferon alpha-C) (LeIF C),0.11
308,P63167,DYL1_HUMAN,"Dynein light chain 1, cytoplasmic (8 kDa dynein light chain) (DLC8) (Dynein light chain LC8-type 1) (Protein inhibitor of neuronal nitric oxide synthase) (PIN)",0.11
309,P37268,FDFT_HUMAN,Squalene synthase (SQS) (SS) (EC 2.5.1.21) (FPP:FPP farnesyltransferase) (Farnesyl-diphosphate farnesyltransferase) (Farnesyl-diphosphate farnesyltransferase 1),0.11
310,O60760,HPGDS_HUMAN,Hematopoietic prostaglandin D synthase (H-PGDS) (EC 5.3.99.2) (GST class-sigma) (Glutathione S-transferase) (EC 2.5.1.18) (Glutathione-dependent PGD synthase) (Glutathione-requiring prostaglandin D synthase) (Prostaglandin-H2 D-isomerase),0.11
311,O95749,GGPPS_HUMAN,"Geranylgeranyl pyrophosphate synthase (GGPP synthase) (GGPPSase) (EC 2.5.1.-) ((2E,6E)-farnesyl diphosphate synthase) (Dimethylallyltranstransferase) (EC 2.5.1.1) (Farnesyl diphosphate synthase) (Farnesyltranstransferase) (EC 2.5.1.29) (Geranylgeranyl diphosphate synthase) (Geranyltranstransferase) (EC 2.5.1.10)",0.11
312,Q9BYV1,AGT2_HUMAN,"Alanine--glyoxylate aminotransferase 2, mitochondrial (AGT 2) (EC 2.6.1.44) ((R)-3-amino-2-methylpropionate--pyruvate transaminase) (EC 2.6.1.40) (Beta-ALAAT II) (Beta-alanine-pyruvate aminotransferase) (D-AIBAT)",0.11
313,P05013,IFNA6_HUMAN,Interferon alpha-6 (IFN-alpha-6) (Interferon alpha-54) (Interferon alpha-K) (LeIF K),0.1
314,O94777,DPM2_HUMAN,Dolichol phosphate-mannose biosynthesis regulatory protein (Dolichol-phosphate mannose synthase subunit 2) (DPM synthase subunit 2),0.1
315,P14406,CX7A2_HUMAN,"Cytochrome c oxidase subunit 7A2, mitochondrial (Cytochrome c oxidase subunit VIIa-liver/heart) (Cytochrome c oxidase subunit VIIa-L) (Cytochrome c oxidase subunit VIIaL)",0.1
316,P01570,IFN14_HUMAN,Interferon alpha-14 (IFN-alpha-14) (Interferon alpha-H) (LeIF H) (Interferon lambda-2-H),0.1
317,P01567,IFNA7_HUMAN,Interferon alpha-7 (IFN-alpha-7) (Interferon alpha-J) (LeIF J) (Interferon alpha-J1) (IFN-alpha-J1),0.1
318,P05015,IFN16_HUMAN,Interferon alpha-16 (IFN-alpha-16) (Interferon alpha-WA),0.1
319,O14735,CDIPT_HUMAN,CDP-diacylglycerol--inositol 3-phosphatidyltransferase (EC 2.7.8.11) (Phosphatidylinositol synthase) (PI synthase) (PtdIns synthase),0.1
320,Q99766,ATP5S_HUMAN,"ATP synthase subunit s, mitochondrial (ATP synthase-coupling factor B) (FB) (Distal membrane arm assembly complex 2-like protein) (Mitochondrial ATP synthase regulatory component factor B)",0.1
321,Q9UDW1,QCR9_HUMAN,Cytochrome b-c1 complex subunit 9 (Complex III subunit 9) (Complex III subunit X) (Cytochrome c1 non-heme 7 kDa protein) (Ubiquinol-cytochrome c reductase complex 7.2 kDa protein),0.09
