Rank,UniProt_ID,STRING_ID,Protein_Names,pLLPS_Score
1,Q16821,PPR3A_HUMAN,Protein phosphatase 1 regulatory subunit 3A (Protein phosphatase 1 glycogen-associated regulatory subunit) (Protein phosphatase type-1 glycogen targeting subunit) (RG1),1.0
2,P35638,DDIT3_HUMAN,DNA damage-inducible transcript 3 protein (DDIT-3) (C/EBP zeta) (C/EBP-homologous protein) (CHOP) (C/EBP-homologous protein 10) (CHOP-10) (CCAAT/enhancer-binding protein homologous protein) (Growth arrest and DNA damage-inducible protein GADD153),1.0
3,P18848,ATF4_HUMAN,Cyclic AMP-dependent transcription factor ATF-4 (cAMP-dependent transcription factor ATF-4) (Activating transcription factor 4) (Cyclic AMP-responsive element-binding protein 2) (CREB-2) (cAMP-responsive element-binding protein 2) (Tax-responsive enhancer element-binding protein 67) (TaxREB67),0.99
4,Q5VWQ8,DAB2P_HUMAN,Disabled homolog 2-interacting protein (DAB2 interaction protein) (DAB2-interacting protein) (ASK-interacting protein 1) (AIP-1) (DOC-2/DAB-2 interactive protein),0.99
5,Q9H7J1,PPR3E_HUMAN,Protein phosphatase 1 regulatory subunit 3E,0.98
6,Q96RS0,TGS1_HUMAN,Trimethylguanosine synthase (EC 2.1.1.-) (CLL-associated antigen KW-2) (Cap-specific guanine-N2 methyltransferase) (Hepatocellular carcinoma-associated antigen 137) (Nuclear receptor coactivator 6-interacting protein) (PRIP-interacting protein with methyltransferase motif) (PIMT) (PIPMT),0.98
7,O15516,CLOCK_HUMAN,Circadian locomoter output cycles protein kaput (hCLOCK) (EC 2.3.1.48) (Class E basic helix-loop-helix protein 8) (bHLHe8),0.95
8,Q12772,SRBP2_HUMAN,Sterol regulatory element-binding protein 2 (SREBP-2) (Class D basic helix-loop-helix protein 2) (bHLHd2) (Sterol regulatory element-binding transcription factor 2) [Cleaved into: Processed sterol regulatory element-binding protein 2],0.92
9,P10606,COX5B_HUMAN,"Cytochrome c oxidase subunit 5B, mitochondrial (Cytochrome c oxidase polypeptide Vb)",0.88
10,Q9Y314,NOSIP_HUMAN,Nitric oxide synthase-interacting protein (E3 ubiquitin-protein ligase NOSIP) (EC 2.3.2.27) (RING-type E3 ubiquitin transferase NOSIP) (eNOS-interacting protein),0.87
11,Q96LL9,DJC30_HUMAN,"DnaJ homolog subfamily C member 30, mitochondrial (Williams-Beuren syndrome chromosomal region 18 protein)",0.87
12,Q9UII2,ATIF1_HUMAN,"ATPase inhibitor, mitochondrial (ATP synthase F1 subunit epsilon) (Inhibitor of F(1)F(o)-ATPase) (IF(1)) (IF1)",0.84
13,Q02221,CX6A2_HUMAN,"Cytochrome c oxidase subunit 6A2, mitochondrial (Cytochrome c oxidase polypeptide VIa-heart) (COXVIAH) (Cytochrome c oxidase subunit VIA-muscle) (COX VIa-M)",0.84
14,O15488,GLYG2_HUMAN,Glycogenin-2 (GN-2) (GN2) (EC 2.4.1.186),0.82
15,P07919,QCR6_HUMAN,"Cytochrome b-c1 complex subunit 6, mitochondrial (Complex III subunit 6) (Complex III subunit VIII) (Cytochrome c1 non-heme 11 kDa protein) (Mitochondrial hinge protein) (Ubiquinol-cytochrome c reductase complex 11 kDa protein)",0.8
16,P03928,ATP8_HUMAN,ATP synthase protein 8 (A6L) (F-ATPase subunit 8),0.79
17,P29474,NOS3_HUMAN,"Nitric oxide synthase, endothelial (EC 1.14.13.39) (Constitutive NOS) (cNOS) (EC-NOS) (Endothelial NOS) (eNOS) (NOS type III) (NOSIII)",0.79
18,P49840,GSK3A_HUMAN,Glycogen synthase kinase-3 alpha (GSK-3 alpha) (EC 2.7.11.26) (Serine/threonine-protein kinase GSK3A) (EC 2.7.11.1),0.78
19,P12074,CX6A1_HUMAN,"Cytochrome c oxidase subunit 6A1, mitochondrial (Cytochrome c oxidase polypeptide VIa-liver) (Cytochrome c oxidase subunit VIA-liver) (COX VIa-L)",0.78
20,Q96RG2,PASK_HUMAN,PAS domain-containing serine/threonine-protein kinase (PAS-kinase) (PASKIN) (hPASK) (EC 2.7.11.1),0.77
21,P07814,SYEP_HUMAN,Bifunctional glutamate/proline--tRNA ligase (Bifunctional aminoacyl-tRNA synthetase) (Cell proliferation-inducing gene 32 protein) (Glutamatyl-prolyl-tRNA synthetase) [Includes: Glutamate--tRNA ligase (EC 6.1.1.17) (Glutamyl-tRNA synthetase) (GluRS); Proline--tRNA ligase (EC 6.1.1.15) (Prolyl-tRNA synthetase)],0.76
22,Q15185,TEBP_HUMAN,Prostaglandin E synthase 3 (EC 5.3.99.3) (Cytosolic prostaglandin E2 synthase) (cPGES) (Hsp90 co-chaperone) (Progesterone receptor complex p23) (Telomerase-binding protein p23),0.76
23,O75052,CAPON_HUMAN,Carboxyl-terminal PDZ ligand of neuronal nitric oxide synthase protein (C-terminal PDZ ligand of neuronal nitric oxide synthase protein) (Nitric oxide synthase 1 adaptor protein),0.75
24,Q9BQC3,DPH2_HUMAN,2-(3-amino-3-carboxypropyl)histidine synthase subunit 2 (EC 2.5.1.108) (Diphthamide biosynthesis protein 2) (Diphtheria toxin resistance protein 2) (S-adenosyl-L-methionine:L-histidine 3-amino-3-carboxypropyltransferase 2),0.67
25,Q96HJ9,FMC1_HUMAN,"Protein FMC1 homolog (ATP synthase assembly factor FMC1, mitochondrial) (Formation of mitochondrial complex V assembly factor 1 homolog)",0.65
26,Q5ST30,SYVM_HUMAN,"Valine--tRNA ligase, mitochondrial (EC 6.1.1.9) (Valyl-tRNA synthetase) (ValRS) (Valyl-tRNA synthetase-like)",0.61
27,Q96KJ9,COX42_HUMAN,"Cytochrome c oxidase subunit 4 isoform 2, mitochondrial (Cytochrome c oxidase subunit IV isoform 2) (COX IV-2)",0.6
28,Q9Y606,TRUA_HUMAN,tRNA pseudouridine synthase A (EC 5.4.99.12) (tRNA pseudouridine(38-40) synthase) (tRNA pseudouridylate synthase I) (tRNA-uridine isomerase I),0.58
29,Q13057,COASY_HUMAN,Bifunctional coenzyme A synthase (CoA synthase) (NBP) (POV-2) [Includes: Phosphopantetheine adenylyltransferase (EC 2.7.7.3) (Dephospho-CoA pyrophosphorylase) (Pantetheine-phosphate adenylyltransferase) (PPAT); Dephospho-CoA kinase (DPCK) (EC 2.7.1.24) (Dephosphocoenzyme A kinase) (DPCOAK)],0.58
30,P51788,CLCN2_HUMAN,Chloride channel protein 2 (ClC-2),0.57
31,P49327,FAS_HUMAN,Fatty acid synthase (EC 2.3.1.85) [Includes: [Acyl-carrier-protein] S-acetyltransferase (EC 2.3.1.38); [Acyl-carrier-protein] S-malonyltransferase (EC 2.3.1.39); 3-oxoacyl-[acyl-carrier-protein] synthase (EC 2.3.1.41); 3-oxoacyl-[acyl-carrier-protein] reductase (EC 1.1.1.100); 3-hydroxyacyl-[acyl-carrier-protein] dehydratase (EC 4.2.1.59); Enoyl-[acyl-carrier-protein] reductase (EC 1.3.1.39); Oleoyl-[acyl-carrier-protein] hydrolase (EC 3.1.2.14)],0.57
32,Q7Z4L0,COX8C_HUMAN,"Cytochrome c oxidase subunit 8C, mitochondrial (Cytochrome c oxidase polypeptide 8 isoform 3) (Cytochrome c oxidase polypeptide VIII isoform 3) (COX VIII-3) (Cytochrome c oxidase subunit 8-3) (COX8-3) (Cytochrome c oxidase subunit VIIIC)",0.57
33,O76031,CLPX_HUMAN,"ATP-dependent Clp protease ATP-binding subunit clpX-like, mitochondrial",0.54
34,P15104,GLNA_HUMAN,Glutamine synthetase (GS) (EC 6.3.1.2) (Glutamate--ammonia ligase) (Palmitoyltransferase GLUL) (EC 2.3.1.225),0.53
35,Q8N884,CGAS_HUMAN,Cyclic GMP-AMP synthase (cGAMP synthase) (cGAS) (h-cGAS) (EC 2.7.7.86) (2'3'-cGAMP synthase) (Mab-21 domain-containing protein 1),0.53
36,P26640,SYVC_HUMAN,Valine--tRNA ligase (EC 6.1.1.9) (Protein G7a) (Valyl-tRNA synthetase) (ValRS),0.52
37,P54577,SYYC_HUMAN,"Tyrosine--tRNA ligase, cytoplasmic (EC 6.1.1.1) (Tyrosyl-tRNA synthetase) (TyrRS) [Cleaved into: Tyrosine--tRNA ligase, cytoplasmic, N-terminally processed]",0.52
38,O15067,PUR4_HUMAN,Phosphoribosylformylglycinamidine synthase (FGAM synthase) (FGAMS) (EC 6.3.5.3) (Formylglycinamide ribonucleotide amidotransferase) (FGAR amidotransferase) (FGAR-AT) (Formylglycinamide ribotide amidotransferase),0.52
39,O60869,EDF1_HUMAN,Endothelial differentiation-related factor 1 (EDF-1) (Multiprotein-bridging factor 1) (MBF1),0.52
40,Q12904,AIMP1_HUMAN,Aminoacyl tRNA synthase complex-interacting multifunctional protein 1 (Multisynthase complex auxiliary component p43) [Cleaved into: Endothelial monocyte-activating polypeptide 2 (EMAP-2) (Endothelial monocyte-activating polypeptide II) (EMAP-II) (Small inducible cytokine subfamily E member 1)],0.52
41,Q9NTG7,SIR3_HUMAN,"NAD-dependent protein deacetylase sirtuin-3, mitochondrial (hSIRT3) (EC 2.3.1.286) (Regulatory protein SIR2 homolog 3) (SIR2-like protein 3)",0.51
42,Q6P1R4,DUS1L_HUMAN,tRNA-dihydrouridine(16/17) synthase [NAD(P)(+)]-like (EC 1.3.1.-) (tRNA-dihydrouridine synthase 1-like),0.51
43,Q96G46,DUS3L_HUMAN,tRNA-dihydrouridine(47) synthase [NAD(P)(+)]-like (EC 1.3.1.-) (tRNA-dihydrouridine synthase 3-like),0.5
44,Q86SX6,GLRX5_HUMAN,"Glutaredoxin-related protein 5, mitochondrial (Monothiol glutaredoxin-5)",0.49
45,P13196,HEM1_HUMAN,"5-aminolevulinate synthase, nonspecific, mitochondrial (ALAS-H) (EC 2.3.1.37) (5-aminolevulinic acid synthase 1) (Delta-ALA synthase 1) (Delta-aminolevulinate synthase 1)",0.49
46,P30405,PPIF_HUMAN,"Peptidyl-prolyl cis-trans isomerase F, mitochondrial (PPIase F) (EC 5.2.1.8) (Cyclophilin D) (CyP-D) (CypD) (Cyclophilin F) (Mitochondrial cyclophilin) (CyP-M) (Rotamase F)",0.49
47,P30049,ATPD_HUMAN,"ATP synthase subunit delta, mitochondrial (ATP synthase F1 subunit delta) (F-ATPase delta subunit)",0.48
48,O00116,ADAS_HUMAN,"Alkyldihydroxyacetonephosphate synthase, peroxisomal (Alkyl-DHAP synthase) (EC 2.5.1.26) (Aging-associated gene 5 protein) (Alkylglycerone-phosphate synthase)",0.46
49,Q96PZ0,PUS7_HUMAN,Pseudouridylate synthase 7 homolog (EC 5.4.99.-),0.44
50,Q9NX74,DUS2L_HUMAN,tRNA-dihydrouridine(20) synthase [NAD(P)+]-like (EC 1.3.1.91) (Dihydrouridine synthase 2) (Up-regulated in lung cancer protein 8) (URLC8) (tRNA-dihydrouridine synthase 2-like) (hDUS2),0.44
51,P29475,NOS1_HUMAN,"Nitric oxide synthase, brain (EC 1.14.13.39) (Constitutive NOS) (NC-NOS) (NOS type I) (Neuronal NOS) (N-NOS) (nNOS) (Peptidyl-cysteine S-nitrosylase NOS1) (bNOS)",0.44
52,Q9BZE2,PUS3_HUMAN,tRNA pseudouridine(38/39) synthase (EC 5.4.99.45) (tRNA pseudouridine synthase 3) (tRNA pseudouridylate synthase 3) (tRNA-uridine isomerase 3),0.44
53,Q8IZ73,RUSD2_HUMAN,RNA pseudouridylate synthase domain-containing protein 2,0.43
54,Q05932,FOLC_HUMAN,"Folylpolyglutamate synthase, mitochondrial (EC 6.3.2.17) (Folylpoly-gamma-glutamate synthetase) (FPGS) (Tetrahydrofolylpolyglutamate synthase) (Tetrahydrofolate synthase)",0.43
55,Q9Y285,SYFA_HUMAN,Phenylalanine--tRNA ligase alpha subunit (EC 6.1.1.20) (CML33) (Phenylalanyl-tRNA synthetase alpha subunit) (PheRS),0.42
56,Q8NFF5,FAD1_HUMAN,FAD synthase (EC 2.7.7.2) (FAD pyrophosphorylase) (FMN adenylyltransferase) (Flavin adenine dinucleotide synthase) [Includes: Molybdenum cofactor biosynthesis protein-like region; FAD synthase region],0.42
57,Q5TC12,ATPF1_HUMAN,ATP synthase mitochondrial F1 complex assembly factor 1 (ATP11 homolog),0.41
58,Q9Y6K5,OAS3_HUMAN,2'-5'-oligoadenylate synthase 3 ((2-5')oligo(A) synthase 3) (2-5A synthase 3) (EC 2.7.7.84) (p100 OAS) (p100OAS),0.41
59,P08574,CY1_HUMAN,"Cytochrome c1, heme protein, mitochondrial (EC 7.1.1.8) (Complex III subunit 4) (Complex III subunit IV) (Cytochrome b-c1 complex subunit 4) (Ubiquinol-cytochrome-c reductase complex cytochrome c1 subunit) (Cytochrome c-1)",0.4
60,Q15046,SYK_HUMAN,Lysine--tRNA ligase (EC 2.7.7.-) (EC 6.1.1.6) (Lysyl-tRNA synthetase) (LysRS),0.4
61,Q9UBK8,MTRR_HUMAN,Methionine synthase reductase (MSR) (EC 1.16.1.8) (Aquacobalamin reductase) (AqCbl reductase) (EC 1.16.1.5),0.39
62,P35228,NOS2_HUMAN,"Nitric oxide synthase, inducible (EC 1.14.13.39) (Hepatocyte NOS) (HEP-NOS) (Inducible NO synthase) (Inducible NOS) (iNOS) (NOS type II) (Peptidyl-cysteine S-nitrosylase NOS2)",0.39
63,Q8N159,NAGS_HUMAN,"N-acetylglutamate synthase, mitochondrial (EC 2.3.1.1) (Amino-acid acetyltransferase) [Cleaved into: N-acetylglutamate synthase long form; N-acetylglutamate synthase short form; N-acetylglutamate synthase conserved domain form]",0.39
64,Q96CM3,RUSD4_HUMAN,Mitochondrial RNA pseudouridine synthase RPUSD4 (EC 5.4.99.-) (RNA pseudouridylate synthase domain-containing protein 4),0.39
65,Q96G03,PGM2_HUMAN,Phosphoglucomutase-2 (PGM 2) (EC 5.4.2.2) (Glucose phosphomutase 2) (Phosphodeoxyribomutase) (Phosphopentomutase) (EC 5.4.2.7),0.38
66,Q8N0Z8,PUSL1_HUMAN,tRNA pseudouridine synthase-like 1 (EC 5.4.99.-) (tRNA pseudouridylate synthase-like 1) (tRNA-uridine isomerase-like 1),0.38
67,Q70JA7,CHSS3_HUMAN,Chondroitin sulfate synthase 3 (EC 2.4.1.175) (EC 2.4.1.226) (Carbohydrate synthase 2) (Chondroitin glucuronyltransferase 3) (Chondroitin synthase 2) (ChSy-2) (Glucuronosyl-N-acetylgalactosaminyl-proteoglycan 4-beta-N-acetylgalactosaminyltransferase II) (N-acetylgalactosaminyl-proteoglycan 3-beta-glucuronosyltransferase 3) (N-acetylgalactosaminyltransferase 3),0.38
68,Q8IZ52,CHSS2_HUMAN,Chondroitin sulfate synthase 2 (EC 2.4.1.175) (EC 2.4.1.226) (Chondroitin glucuronyltransferase 2) (Chondroitin-polymerizing factor) (ChPF) (Glucuronosyl-N-acetylgalactosaminyl-proteoglycan 4-beta-N-acetylgalactosaminyltransferase II) (N-acetylgalactosaminyl-proteoglycan 3-beta-glucuronosyltransferase II) (N-acetylgalactosaminyltransferase 2),0.37
69,Q9NP81,SYSM_HUMAN,"Serine--tRNA ligase, mitochondrial (EC 6.1.1.11) (SerRSmt) (Seryl-tRNA synthetase) (SerRS) (Seryl-tRNA(Ser/Sec) synthetase)",0.36
70,Q86X52,CHSS1_HUMAN,Chondroitin sulfate synthase 1 (EC 2.4.1.175) (EC 2.4.1.226) (Chondroitin glucuronyltransferase 1) (Chondroitin synthase 1) (ChSy-1) (Glucuronosyl-N-acetylgalactosaminyl-proteoglycan 4-beta-N-acetylgalactosaminyltransferase 1) (N-acetylgalactosaminyl-proteoglycan 3-beta-glucuronosyltransferase 1) (N-acetylgalactosaminyltransferase 1),0.36
71,P23469,PTPRE_HUMAN,Receptor-type tyrosine-protein phosphatase epsilon (Protein-tyrosine phosphatase epsilon) (R-PTP-epsilon) (EC 3.1.3.48),0.35
72,O95900,TRUB2_HUMAN,Mitochondrial mRNA pseudouridine synthase TRUB2 (EC 5.4.99.-),0.35
73,Q9BUB7,TMM70_HUMAN,"Transmembrane protein 70, mitochondrial",0.34
74,O43776,SYNC_HUMAN,"Asparagine--tRNA ligase, cytoplasmic (EC 6.1.1.22) (Asparaginyl-tRNA synthetase) (AsnRS) (Asparaginyl-tRNA synthetase 1)",0.33
75,Q6UB35,C1TM_HUMAN,"Monofunctional C1-tetrahydrofolate synthase, mitochondrial (EC 6.3.4.3) (Formyltetrahydrofolate synthetase)",0.33
76,P05771,KPCB_HUMAN,Protein kinase C beta type (PKC-B) (PKC-beta) (EC 2.7.11.13),0.33
77,P41250,GARS_HUMAN,Glycine--tRNA ligase (EC 6.1.1.14) (Diadenosine tetraphosphate synthetase) (Ap4A synthetase) (EC 2.7.7.-) (Glycyl-tRNA synthetase) (GlyRS) (Glycyl-tRNA synthetase 1),0.32
78,Q6GTS8,P20D1_HUMAN,N-fatty-acyl-amino acid synthase/hydrolase PM20D1 (EC 3.5.1.-) (EC 4.3.-.-) (Peptidase M20 domain-containing protein 1),0.32
79,P05089,ARGI1_HUMAN,Arginase-1 (EC 3.5.3.1) (Liver-type arginase) (Type I arginase),0.31
80,Q8N5B7,CERS5_HUMAN,Ceramide synthase 5 (CerS5) (EC 2.3.1.-) (LAG1 longevity assurance homolog 5) (Sphingosine N-acyltransferase CERS5) (EC 2.3.1.24),0.31
81,P47985,UCRI_HUMAN,"Cytochrome b-c1 complex subunit Rieske, mitochondrial (EC 7.1.1.8) (Complex III subunit 5) (Cytochrome b-c1 complex subunit 5) (Rieske iron-sulfur protein) (RISP) (Rieske protein UQCRFS1) (Ubiquinol-cytochrome c reductase iron-sulfur subunit) [Cleaved into: Cytochrome b-c1 complex subunit 9 (Su9) (Subunit 9) (8 kDa subunit 9) (Complex III subunit IX) (Cytochrome b-c1 complex subunit 11) (UQCRFS1 mitochondrial targeting sequence) (UQCRFS1 MTS) (Ubiquinol-cytochrome c reductase 8 kDa protein)]",0.31
82,Q9NUB1,ACS2L_HUMAN,"Acetyl-coenzyme A synthetase 2-like, mitochondrial (EC 6.2.1.1) (Acetate--CoA ligase 2) (Acetyl-CoA synthetase 2) (AceCS2) (Acyl-CoA synthetase short-chain family member 1) (Propionate--CoA ligase) (EC 6.2.1.17)",0.3
83,P56385,ATP5I_HUMAN,"ATP synthase subunit e, mitochondrial (ATPase subunit e) (ATP synthase membrane subunit e) [Cleaved into: ATP synthase subunit e, mitochondrial, N-terminally processed]",0.3
84,Q5T2R2,DPS1_HUMAN,Decaprenyl-diphosphate synthase subunit 1 (EC 2.5.1.91) (All-trans-decaprenyl-diphosphate synthase subunit 1) (Decaprenyl pyrophosphate synthase subunit 1) (Trans-prenyltransferase 1) (TPT 1),0.3
85,P13807,GYS1_HUMAN,"Glycogen [starch] synthase, muscle (EC 2.4.1.11)",0.3
86,Q9UJA2,CRLS1_HUMAN,Cardiolipin synthase (CMP-forming) (CLS) (EC 2.7.8.41) (Protein GCD10 homolog),0.3
87,P14868,SYDC_HUMAN,"Aspartate--tRNA ligase, cytoplasmic (EC 6.1.1.12) (Aspartyl-tRNA synthetase) (AspRS) (Cell proliferation-inducing gene 40 protein)",0.29
88,O95757,HS74L_HUMAN,Heat shock 70 kDa protein 4L (Heat shock 70-related protein APG-1) (Osmotic stress protein 94),0.29
89,Q6P087,RUSD3_HUMAN,Mitochondrial mRNA pseudouridine synthase RPUSD3 (EC 5.4.99.-) (RNA pseudouridylate synthase domain-containing protein 3),0.29
90,P13073,COX41_HUMAN,"Cytochrome c oxidase subunit 4 isoform 1, mitochondrial (Cytochrome c oxidase polypeptide IV) (Cytochrome c oxidase subunit IV isoform 1) (COX IV-1)",0.29
91,P18859,ATP5J_HUMAN,"ATP synthase-coupling factor 6, mitochondrial (ATPase subunit F6) (ATP synthase peripheral stalk subunit F6)",0.29
92,P49589,SYCC_HUMAN,"Cysteine--tRNA ligase, cytoplasmic (EC 6.1.1.16) (Cysteinyl-tRNA synthetase) (CysRS)",0.29
93,Q9NR19,ACSA_HUMAN,"Acetyl-coenzyme A synthetase, cytoplasmic (EC 6.2.1.1) (Acetate--CoA ligase) (Acetyl-CoA synthetase) (ACS) (AceCS) (Acetyl-CoA synthetase 1) (AceCS1) (Acyl-CoA synthetase short-chain family member 2) (Acyl-activating enzyme) (Propionate--CoA ligase) (EC 6.2.1.17)",0.29
94,Q8WWH5,TRUB1_HUMAN,Probable tRNA pseudouridine synthase 1 (EC 5.4.99.-),0.29
95,Q8IXN7,RIMKA_HUMAN,N-acetylaspartylglutamate synthase A (NAAG synthetase A) (NAAGS) (EC 6.3.2.41) (N-acetylaspartylglutamylglutamate synthase A) (EC 6.3.2.42) (Ribosomal protein S6 modification-like protein A),0.29
96,P49841,GSK3B_HUMAN,Glycogen synthase kinase-3 beta (GSK-3 beta) (EC 2.7.11.26) (Serine/threonine-protein kinase GSK3B) (EC 2.7.11.1),0.28
97,P17812,PYRG1_HUMAN,CTP synthase 1 (EC 6.3.4.2) (CTP synthetase 1) (UTP--ammonia ligase 1),0.28
98,Q9BX95,SGPP1_HUMAN,Sphingosine-1-phosphate phosphatase 1 (SPPase1) (Spp1) (hSPP1) (hSPPase1) (EC 3.1.3.-) (Sphingosine-1-phosphatase 1) (Sphingosine-1-phosphate phosphohydrolase 1) (SPP-1),0.28
99,Q9P2R7,SUCB1_HUMAN,"Succinate--CoA ligase [ADP-forming] subunit beta, mitochondrial (EC 6.2.1.5) (ATP-specific succinyl-CoA synthetase subunit beta) (A-SCS) (Succinyl-CoA synthetase beta-A chain) (SCS-betaA)",0.27
100,Q96GW9,SYMM_HUMAN,"Methionine--tRNA ligase, mitochondrial (EC 6.1.1.10) (Methionyl-tRNA synthetase 2) (Mitochondrial methionyl-tRNA synthetase) (MtMetRS)",0.27
101,P04818,TYSY_HUMAN,Thymidylate synthase (TS) (TSase) (EC 2.1.1.45),0.27
102,Q15070,OXA1L_HUMAN,Mitochondrial inner membrane protein OXA1L (Hsa) (OXA1Hs) (Oxidase assembly 1-like protein) (OXA1-like protein),0.27
103,Q9UJJ7,RUSD1_HUMAN,RNA pseudouridylate synthase domain-containing protein 1 (Ribosomal large subunit pseudouridine synthase C-like protein),0.27
104,Q9BVG9,PTSS2_HUMAN,Phosphatidylserine synthase 2 (PSS-2) (PtdSer synthase 2) (EC 2.7.8.29) (Serine-exchange enzyme II),0.27
105,Q9NWU1,OXSM_HUMAN,"3-oxoacyl-[acyl-carrier-protein] synthase, mitochondrial (EC 2.3.1.41) (Beta-ketoacyl-ACP synthase)",0.27
106,P23381,SYWC_HUMAN,"Tryptophan--tRNA ligase, cytoplasmic (EC 6.1.1.2) (Interferon-induced protein 53) (IFP53) (Tryptophanyl-tRNA synthetase) (TrpRS) (hWRS) [Cleaved into: T1-TrpRS; T2-TrpRS]",0.27
107,Q9H6R3,ACSS3_HUMAN,"Acyl-CoA synthetase short-chain family member 3, mitochondrial (EC 6.2.1.1) (Acetate--CoA ligase 3) (Acyl-CoA synthetase short-chain family member 3) (Propionate--CoA ligase) (EC 6.2.1.17)",0.27
108,Q5JTZ9,SYAM_HUMAN,"Alanine--tRNA ligase, mitochondrial (EC 6.1.1.7) (Alanyl-tRNA synthetase) (AlaRS)",0.26
109,Q8N9F0,NAT8L_HUMAN,N-acetylaspartate synthetase (NAA synthetase) (EC 2.3.1.17) (Camello-like protein 3) (N-acetyltransferase 8-like protein),0.26
110,Q9Y2P5,S27A5_HUMAN,"Bile acyl-CoA synthetase (BACS) (EC 6.2.1.7) (Bile acid-CoA ligase) (BA-CoA ligase) (BAL) (Cholate--CoA ligase) (Fatty acid transport protein 5) (FATP-5) (Fatty-acid-coenzyme A ligase, very long-chain 3) (Solute carrier family 27 member 5) (Very long-chain acyl-CoA synthetase homolog 2) (VLCS-H2) (VLCSH2) (Very long-chain acyl-CoA synthetase-related protein) (VLACS-related) (VLACSR)",0.26
111,P53396,ACLY_HUMAN,ATP-citrate synthase (EC 2.3.3.8) (ATP-citrate (pro-S-)-lyase) (ACL) (Citrate cleavage enzyme),0.26
112,P49591,SYSC_HUMAN,"Serine--tRNA ligase, cytoplasmic (EC 6.1.1.11) (Seryl-tRNA synthetase) (SerRS) (Seryl-tRNA(Ser/Sec) synthetase)",0.26
113,Q9NSE4,SYIM_HUMAN,"Isoleucine--tRNA ligase, mitochondrial (EC 6.1.1.5) (Isoleucyl-tRNA synthetase) (IleRS)",0.26
114,Q68CK6,ACS2B_HUMAN,"Acyl-coenzyme A synthetase ACSM2B, mitochondrial (EC 6.2.1.2) (Acyl-CoA synthetase medium-chain family member 2B) (Benzoate--CoA ligase) (EC 6.2.1.25) (Butyrate--CoA ligase 2B) (Butyryl-coenzyme A synthetase 2B) (Middle-chain acyl-CoA synthetase 2B) (Xenobiotic/medium-chain fatty acid-CoA ligase HXM-A)",0.25
115,Q9BW92,SYTM_HUMAN,"Threonine--tRNA ligase, mitochondrial (EC 6.1.1.3) (Threonyl-tRNA synthetase) (ThrRS) (Threonyl-tRNA synthetase-like 1)",0.25
116,Q2M296,MTHSD_HUMAN,Methenyltetrahydrofolate synthase domain-containing protein,0.25
117,P00966,ASSY_HUMAN,Argininosuccinate synthase (EC 6.3.4.5) (Citrulline--aspartate ligase),0.25
118,P29728,OAS2_HUMAN,2'-5'-oligoadenylate synthase 2 ((2-5')oligo(A) synthase 2) (2-5A synthase 2) (EC 2.7.7.84) (p69 OAS / p71 OAS) (p69OAS / p71OAS),0.24
119,Q9BZG8,DPH1_HUMAN,2-(3-amino-3-carboxypropyl)histidine synthase subunit 1 (EC 2.5.1.108) (Diphthamide biosynthesis protein 1) (Diphtheria toxin resistance protein 1) (Ovarian cancer-associated gene 1 protein) (S-adenosyl-L-methionine:L-histidine 3-amino-3-carboxypropyltransferase 1),0.24
120,Q8TF08,CX7B2_HUMAN,"Cytochrome c oxidase subunit 7B2, mitochondrial (Cytochrome c oxidase polypeptide VIIb2)",0.24
121,P53597,SUCA_HUMAN,"Succinate--CoA ligase [ADP/GDP-forming] subunit alpha, mitochondrial (EC 6.2.1.4) (EC 6.2.1.5) (Succinyl-CoA synthetase subunit alpha) (SCS-alpha)",0.24
122,P31153,METK2_HUMAN,S-adenosylmethionine synthase isoform type-2 (AdoMet synthase 2) (EC 2.5.1.6) (Methionine adenosyltransferase 2) (MAT 2) (Methionine adenosyltransferase II) (MAT-II),0.24
123,Q16647,PTGIS_HUMAN,Prostacyclin synthase (EC 5.3.99.4) (Hydroperoxy icosatetraenoate dehydratase) (EC 4.2.1.152) (Prostaglandin I2 synthase),0.24
124,P06576,ATPB_HUMAN,"ATP synthase subunit beta, mitochondrial (EC 7.1.2.2) (ATP synthase F1 subunit beta)",0.24
125,P05496,AT5G1_HUMAN,"ATP synthase F(0) complex subunit C1, mitochondrial (ATP synthase lipid-binding protein) (ATP synthase membrane subunit c locus 1) (ATP synthase proteolipid P1) (ATP synthase proton-transporting mitochondrial F(0) complex subunit C1) (ATPase protein 9) (ATPase subunit c)",0.23
126,O75390,CISY_HUMAN,"Citrate synthase, mitochondrial (EC 2.3.3.1) (Citrate (Si)-synthase)",0.23
127,Q9H7Z7,PGES2_HUMAN,Prostaglandin E synthase 2 (Membrane-associated prostaglandin E synthase-2) (mPGE synthase-2) (Microsomal prostaglandin E synthase 2) (mPGES-2) (Prostaglandin-H(2) E-isomerase) (EC 5.3.99.3) [Cleaved into: Prostaglandin E synthase 2 truncated form],0.23
128,Q9HA82,CERS4_HUMAN,Ceramide synthase 4 (CerS4) (EC 2.3.1.-) (LAG1 longevity assurance homolog 4) (Sphingosine N-acyltransferase CERS4) (EC 2.3.1.24),0.23
129,Q8N5M1,ATPF2_HUMAN,ATP synthase mitochondrial F1 complex assembly factor 2 (ATP12 homolog),0.23
130,P21741,MK_HUMAN,Midkine (MK) (Amphiregulin-associated protein) (ARAP) (Midgestation and kidney protein) (Neurite outgrowth-promoting factor 2) (Neurite outgrowth-promoting protein),0.22
131,P48201,AT5G3_HUMAN,"ATP synthase F(0) complex subunit C3, mitochondrial (ATP synthase lipid-binding protein) (ATP synthase membrane subunit c locus 3) (ATP synthase proteolipid P3) (ATP synthase proton-transporting mitochondrial F(0) complex subunit C3) (ATPase protein 9) (ATPase subunit c)",0.22
132,Q4AC99,1A1L2_HUMAN,Probable inactive 1-aminocyclopropane-1-carboxylate synthase-like protein 2 (ACC synthase-like protein 2),0.22
133,Q14012,KCC1A_HUMAN,Calcium/calmodulin-dependent protein kinase type 1 (EC 2.7.11.17) (CaM kinase I) (CaM-KI) (CaM kinase I alpha) (CaMKI-alpha),0.22
134,O43866,CD5L_HUMAN,CD5 antigen-like (Apoptosis inhibitor expressed by macrophages) (hAIM) (CT-2) (IgM-associated peptide) (SP-alpha),0.22
135,Q00266,METK1_HUMAN,S-adenosylmethionine synthase isoform type-1 (AdoMet synthase 1) (EC 2.5.1.6) (Methionine adenosyltransferase 1) (MAT 1) (Methionine adenosyltransferase I/III) (MAT-I/III),0.21
136,P56378,ATP68_HUMAN,"ATP synthase subunit ATP5MPL, mitochondrial (6.8 kDa mitochondrial proteolipid protein) (MLQ) (ATP synthase membrane subunit 6.8PL)",0.21
137,Q9NRF8,PYRG2_HUMAN,CTP synthase 2 (EC 6.3.4.2) (CTP synthetase 2) (UTP--ammonia ligase 2),0.21
138,Q9BU89,DOHH_HUMAN,Deoxyhypusine hydroxylase (hDOHH) (EC 1.14.99.29) (Deoxyhypusine dioxygenase) (Deoxyhypusine monooxygenase) (HEAT-like repeat-containing protein 1),0.21
139,P22695,QCR2_HUMAN,"Cytochrome b-c1 complex subunit 2, mitochondrial (Complex III subunit 2) (Core protein II) (Ubiquinol-cytochrome-c reductase complex core protein 2)",0.21
140,P0C7M7,ACSM4_HUMAN,"Acyl-coenzyme A synthetase ACSM4, mitochondrial (EC 6.2.1.2) (Acyl-CoA synthetase medium-chain family member 4)",0.21
141,Q9NPH2,INO1_HUMAN,Inositol-3-phosphate synthase 1 (IPS 1) (EC 5.5.1.4) (Myo-inositol 1-phosphate synthase) (MI-1-P synthase) (MIP synthase) (hIPS) (Myo-inositol 1-phosphate synthase A1) (hINO1),0.21
142,Q6ZMG9,CERS6_HUMAN,Ceramide synthase 6 (CerS6) (EC 2.3.1.-) (LAG1 longevity assurance homolog 6),0.21
143,P22557,HEM0_HUMAN,"5-aminolevulinate synthase, erythroid-specific, mitochondrial (ALAS-E) (EC 2.3.1.37) (5-aminolevulinic acid synthase 2) (Delta-ALA synthase 2) (Delta-aminolevulinate synthase 2)",0.21
144,P11586,C1TC_HUMAN,"C-1-tetrahydrofolate synthase, cytoplasmic (C1-THF synthase) [Cleaved into: C-1-tetrahydrofolate synthase, cytoplasmic, N-terminally processed] [Includes: Methylenetetrahydrofolate dehydrogenase (EC 1.5.1.5); Methenyltetrahydrofolate cyclohydrolase (EC 3.5.4.9); Formyltetrahydrofolate synthetase (EC 6.3.4.3)]",0.2
145,P26639,SYTC_HUMAN,"Threonine--tRNA ligase 1, cytoplasmic (EC 6.1.1.3) (Threonyl-tRNA synthetase) (ThrRS) (Threonyl-tRNA synthetase 1)",0.2
